,outlet,url,title,authors,publish_date,text,keywords
60,theprogress,https://www.theprogress.com/sports/clayton-robinson-builds-chilliwack-jets-from-ground-up-during-pandemic/,Clayton Robinson builds Chilliwack Jets from ground up during pandemic – Chilliwack Progress,"['Eric Welsh', 'Local Sports']",2020-07-07 16:30:00-07:00,"Getting a new team off the ground is no easy task. Doing it in a global pandemic is doubly difficult

Starting a team from scratch in any sport is no easy task.

Doing so during a global pandemic adds an extra level of complexity that Clayton Robinson would rather not have.

But the building of the brand new junior B Chilliwack Jets goes on because it must.

On the ice, Robinson has announced several new players in recent weeks, keeping the Jets Twitter feed busy.

As he said he would, Robinson has constructed a roster that is heavy on local talent. Of the 18 skaters currently listed at chilliwackjets.com, nine are from Chilliwack, two are from Hope, two are from Mission and one apiece hail from Abbotsford and Fort Langley.

“It hasn’t been as challenging as I thought it’d be,” Robinson said. “The only difference is we haven’t been able to have an (evaluation) camp, but luckily I wasn’t starting completely from scratch.

“I had a head scout, Cam Miller, with the Nanaimo Buccaneers (of the Vancouver Island Junior B Hockey League) who followed me to Chilliwack and we’ve been able to use the information he brought with him. And we’ve definitely tried to get as many local players as we can.”

READ MORE: Chilliwack Jets to play out of Sardis Sports Complex

READ MORE: Clayton Robinson trying to get junior B team for Chilliwack

Robinson also had the advantage of having coached several of his current players a few years back at the midget level.

His first addition, via trade, was Chilliwack kid Dylan Devers.

“I’ve known Dylan since he was 15 years old,” Robinson said. “He played for me here and played for me in Nanaimo. He’s helped a lot bringing some of these local guys back together.

“A lot of it is word of mouth too with guys I’ve gotten to know in the hockey world, and I think we’ve found some diamonds in the rough.”

Off the ice, it’s been more challenging than it might usually be getting sponsorship dollars in a tough business climate.

The camp that Robinson couldn’t hold because of COVID-19 restrictions would have been a revenue generator, and it’s tough approaching business people who are busy trying to survive.

That’s why Robinson hasn’t gone all-in pursuing sponsorships yet.

“We haven’t really gotten out there too much, but people have been quite generous so far,” he said. “We’re leaving things be a little because in the first year it doesn’t matter if we make the revenue at the beginning of the year or the end of the year.

“I’d almost rather wait until things smooth out a bit before we push.”

The PJHL is a pay-to-play league, and revenue from players is a big part of the bottom line.

On the plus side, the Jets will also have advertising revenue from whatever goes on the walls at the new Sardis Sports Complex rink.

“It’s a bare building with nothing in there, so there’s a lot of work to do,” Robinson said. “Luckily for us, myself and my partners have strong ties to the community and I think we’ll do okay. I think the more we get out there, the more people know about the team and how local we are, the more they’ll support us.”

The team ran its first full practice Monday night, with 15 guys on the ice for a no-contact physically-distanced workout at the Chilliwack Coliseum, which gave Robinson a reminder of why he’s doing what he’s doing.

“It’s tons of fun and I’m loving it,” Robinson said. “It’s a job but it’s not a job, talking hockey with people 24/7.

“All of it’s like living my dream.”

@ProgressSports

eric.welsh@theprogress.com

Like us on Facebook and follow us on Twitter.

Want to support local journalism during the pandemic? Make a donation here.

chilliwackhockey",[]
61,theprogress,https://www.theprogress.com/sports/john-mlikotic-headlines-loaded-field-for-chilliwack-mens-open-golf-tournament/,John Mlikotic headlines loaded field for Chilliwack Men’s Open golf tournament – Chilliwack Progress,"['Eric Welsh', 'Local Sports']",2020-07-07 13:15:00-07:00,"The annual event includes the defending champion, along with many others vying to dethrone him

The Chilliwack Golf Club and title sponsor Langley Concrete Group will host the 2020 Men’s Open golf tournament July 11-12.

The annual tourney draws many of British Columbia’s most notable players in the game year.

“The Chilliwack Men’s Open is one of British Columbia’s longest running open tournaments,” said Chilliwack Golf Club general manager Bryan Ewart. “We are very fortunate to attract such a strong field every year.

“This year’s roster includes defending professional champion John Mlikotic. John recently won the Vancouver Golf Tour Chilliwack Championship in a field which included PGA tour player Nick Taylor. It will be an exciting year with lots of up-and-coming professionals and amateurs.”

READ MORE: Nick Taylor Charity Pro-Am raises more than $100,000

READ MORE: Provincial golf championships go ahead with COVID-19 protocols

Mlikotic won last year’s tourney in thrilling fashion, holding off challenges from Brad Clapp and Bryn Parry.

Those two tied for second place, three points behind the leader.

It’s a challenging year to host any sporting event, and Ewart acknowledged there will be changes at this year’s tournament. But he believes organizers can succeed in creating something that is fun and competitive while also being safe. Among the alterations is a reduced field of 150 golfers with no caddies allowed for pros or amateurs.

Familiar features from prior years missing this year include the Friday Night Horse Race, 15th Hole Beer Garden and the Saturday Night Party.

But the tournament does include a cash skins game and a first place grand prize of $2,000.

There will be a $500 prize for the Chilliwack Golf Club pro winner.

There will be four amateur flights.

For more info, see chilliwackgolf.com/Tournaments/Mens_Open

@ProgressSports

eric.welsh@theprogress.com

Like us on Facebook and follow us on Twitter.

Want to support local journalism during the pandemic? Make a donation here.

chilliwackGolf",[]
62,theprogress,https://www.theprogress.com/sports/fraser-valley-bandits-complete-2020-coaching-staff/,Fraser Valley Bandits complete 2020 coaching staff – Chilliwack Progress,['Ben Lypka'],2020-07-07 10:11:00-07:00,"Four names added for the 2020 CEBL season, which begins on July 26 for the club

New assistant coach David Singleton was one of four additions to the Fraser Valley Bandits coaching staff for 2020. (Photo courtesy Vietnam Basketball Association)

The Fraser Valley Bandits have filled out the team’s coaching staff for the 2020 Canadian Elite Basketball League season.

Joining new head coach and general manager Kyle Julius will be Rob Damiani as assistant general manager, David Singleton as assistant coach, K.J. Smith as an advance scout, as well as Julius’ father, Stu, who will serve as a senior advisor.

The news also means 2019 Bandits assistant coaches Virgil Hill and Kyle Graves will not be returning.

Julius was hired as Bandits head coach and general manager back in December.

RELATED: Fraser Valley Bandits name new head coach, general manager

BREAKING: We just got stronger 💪. @Juliushoops enlists decades of experience at the professional and university levels around the🌐to solidify our coaching staff for the @CEBLeague Summer Series. More: https://t.co/GVVIwDXHR8#YearOfTheBandit x #OurGame pic.twitter.com/anXhcafWvG — Fraser Valley Bandits (@FV_Bandits) July 7, 2020

Damiani brings more than five years of basketball operations experience from the NBLC. He first worked under Julius with the Mississauga Power in 2014-15 and then joined the Kitchener-Waterloo (KW) Titans as the club’s assistant general manager in 2016-17. Damiani spent three total seasons with the Titans before joining the Formosa Dreamers as an advance scout in the fall of 2019 to support Julius’ basketball operations staff in the ASEAN Basketball League (ABL).

Singleton has coached professionally in New Zealand, Vietnam and Indonesia. In particular, Singleton served as the Head Coach and General Manager of the Cantho Catfish in the Vietnam Basketball Association (VBA) during the 2016 campaign. Singleton then joined the Saigon Heat as the lead assistant coach on Julius’ staff in the ABL for two seasons from 2017-2019. Specializing in video coordination and player development, Singleton became the Heat’s head coach for its 2019 campaign and led the team to its first VBA championship with recently signed Bandit Tavarion Nix at the Heat’s helm.

Smith is currently an assistant coach for Basquete Unifacisa in Novo Basquete Brasil, the first division league of Brazil’s Liga Nacional de Basquete. The 2018-19 season was Smith’s first year with the club and he helped the team win its first Liga Ouro (second division) championship thanks to a top four offensive and defensive ranking. Following the championship, the team was promoted to the first division where they were preparing for the playoffs prior to the outbreak of COVID-19 and the cancellation of the season.

He is the eighth basketball coach in a family that has dedicated itself to the game for generations. The members of his family’s coaching lineage extend from the high school level to the WNBA. Smith’s grandfather, Fred Smith, was drafted in 1968 to the Milwaukee Bucks. Smith specializes in both player development and scouting. He got his start coaching Amateur Athletic Union (AAU) basketball with the North Bay Basketball Academy (California) and the Erik Spoelstra Basketball Academy. He has also worked as a scout for PrepHoops Northern California, evaluating youth basketball talent with prospective collegiate potential.

Stu Julius will serve as a senior advisor on his son Kyle’s staff. Stu has a decorated basketball lineage that spans various levels of Canadian professional basketball. Stu joined the Lakehead Thunderwolves program in 1981 and served as head coach of the women’s basketball team for 18 years. He was named coach of the year twice during his tenure as head coach at Lakehead.

Lakehead missed the playoffs just once under Julius’ watch as he amassed an impressive coaching record of 311- 250 with the Thunderwolves.

He led the Thunderwolves to nationals twice and took the mantle as athletic director in 1991. Over the course of eight years as athletic director, the Thunderwolves hosted nationals four times between 1995 and 1997-1999. Julius was inducted onto the Lakehead athletics department’s wall of fame in 2013.

Following his time at Lakehead, Julius joined Wilfrid Laurier University’s women’s basketball program in 1999 as the team’s head coach. He led the Golden Hawks for nine seasons. Under Julius’ guidance, the Golden Hawks won a provincial silver medal and advanced to the Canadian Interuniversity Sport (CIS, now known as U Sports) championships in 2002-03 and 2003-04. For his efforts, Julius was named Ontario University Athletics (OUA) West Division Coach of the Year in 2002-03.

Since moving on from Canadian university sport, Julius has worked in the NBLC, both as an assistant coach with the Mississauga Power during the 2014-15 season, as general manager of the KW Titans in 2016-17, and as a performance consultant for the St. John’s Edge in 2018-19.

abbotsfordbasketball",[]
63,theprogress,https://www.theprogress.com/sports/canadian-elite-basketball-league-to-use-elam-ending-in-summer-series/,Canadian Elite Basketball League to use Elam Ending in Summer Series – Chilliwack Progress,"['Eric Welsh', 'Local Sports']",2020-07-06 16:30:00-07:00,"The Canadian Elite Basketball League has shown itself to be open to innovative ideas, and that trend will continue when the second-year circuit tips off its Summer Series later this month.

The seven-team 15-day tournament begins July 25 and will include the ‘Elam Ending’ in all 26 games.

The concept caught the attention of hoops fans at the most recent NBA all-star game. Created by Ball State University prof Nick Elam, the end-of-game rule takes away the score clock inside the final four minutes, replacing it with a target score.

At the first stoppage of play at or under four minute mark of the fourth quarter, timed play ends and a target score is set, equal to the leading team’s score plus nine. For example, if Abbotsford’s Fraser Valley Bandits lead the Edmonton Stingers 77-71 at the stoppage, the target score after adding nine points to the Bandits’ total is 86.

The first team to reach the target score wins the game.

READ MORE: Canadian Elite Basketball League brings pro sports back to the spotlight

READ MORE: Fraser Valley Bandits add international journeyman to front court

Only two timeouts per team can be used during untimed play, with Elam striving to eliminate the lack of flow that comes from intentional fouling, seemingly endless timeouts and rushed possessions.

“I am excited about the CEBL’s bold vision to implement the Elam Ending, and to be the first to do so in FIBA play,” Elam said. “Whether at the NBA All-Star Game, TBT: The Basketball Tournament, or countless grassroots-level leagues and events throughout the basketball world, the Elam Ending continues to prove its ability to preserve high-quality, fluid, and intense play all the way through the end of the game.”

CEBL commissioner Mike Morreale is excited to see the Elam Ending in action.

“The Elam Ending ensures that every contest ends on a winning basket,” the basketball boss said. “We will have 26 heroes for all 26 of our CEBL Summer Series games. It greatly enhances the viewing experience for fans, and the game experience for players and coaches.”

The CEBL Summer Series sees the Bandits tipping off against Edmonton, Ottawa, Hamilton, Guelph, Saskatchewan (Saskatoon) and host Niagara at the Meridian Centre in St. Catharines for a round robin competition leading to a playoff bracket and title game.

See cebl.ca for more info.

@ProgressSports

eric.welsh@theprogress.com

Like us on Facebook and follow us on Twitter.

Want to support local journalism during the pandemic? Make a donation here.

basketball",[]
64,theprogress,https://www.theprogress.com/sports/fraser-valley-bandits-cebl-bringing-pro-sports-back-later-this-month/,"Fraser Valley Bandits, CEBL bringing pro sports back later this month – Chilliwack Progress",['Ben Lypka'],2020-07-05 12:09:00-07:00,"The Fraser Valley Bandits will take on the Hamilton Honey Badgers live on CBC on Aug. 1. (Fraser Valley Bandits photo)

The Canadian Elite Basketball League will be the first professional sports league to return to action in Canada, with games occurring later this month.

The stage has also been set for the Abbotsford-based Fraser Valley Bandits, as the league released its Summer Series schedule earlier this week.

Games tip-off in St. Catharines, Ont. starting on July 25, with the Bandits opening the six-game initial round robin against the Edmonton Stingers on July 26 at 1 p.m. local time.

Game ready. 23 days until we tip-off. History awaits at the @CEBLeague Summer Series on https://t.co/PEDq6ON1Bs and CBC Gem App 🔥 🦊opener: July 26 vs. EDM Nationally televised on @cbcsports📺: Aug. 1 vs. HAM 🗞️: https://t.co/Zy2Ph5afLV#YearOfTheBandit x #OurGame pic.twitter.com/ITtcJbP8tO — Fraser Valley Bandits (@FV_Bandits) July 3, 2020

The Bandits schedule then sees the club challenge the Saskatchewan Rattlers on July 28 at 4:30 p.m., the expansion Ottawa Blackjacks on July 30 at 4 p.m., the Hamilton Honey Badgers on Aug. 1 at 10:30 a.m., the Niagara River Lions on Aug. 2 at 1 p.m. and then finish with the Guelph Nighthawks on Aug. 5 at 2 p.m.

The CEBL team with the worst record will then be eliminated and and a six-team playoff will begin. The top two teams will receive byes, with the third ranked team taking on sixth and four and five squaring off. The CEBL championship game is set for Aug. 9.

Games will not be played in front of fans and teams will be separated from the general public with screening and COVID-19 protocols under the supervision of medical officials in place. Health and safety measures will be maintained for the participants, including social distancing and other specialized practices designed to limit interactions amongst participants.

A handful of games will be broadcast on CBC television, with the Bandits lone TV appearance occurring on Aug. 1 against Hamilton. All other games can be viewed on the CBC Gem streaming service.

“We are excited to bring live sports back to audiences in local communities across the country, who are just as hungry for the return to play as we are,” stated Chris Wilson, Executive Director, Sports & Olympics, CBC. “Our partners at the CEBL have come up with a plan that not only adheres to health and safety restrictions, but takes the competition to the next level. The condensed season means each game means that much more, and we are thrilled to be able to provide a national stage for these athletes and the league. This tournament will be exciting summer entertainment for Canadians at just the right time.”

The 2020 CEBL season has been on delay since mid-April with its originally scheduled tipoff date of May 7. Each club had been scheduled to play a 20-game schedule leading to a final four CEBL Championship Weekend in Edmonton, August 14 to 16.

RELATED: Fraser Valley Bandits won’t play CEBL home games in 2020

abbotsfordbasketball",[]
65,theprogress,https://www.theprogress.com/autos/the-hot-hatch-corolla-is-a-go/,The hot-hatch Corolla is a go – Chilliwack Progress,"['Buyers Advice', 'Car Reviews']",2020-06-15 15:30:00-07:00,"The hot-hatch Corolla is a go:

Word has reached The Sleuth that Toyota will introduce a competitor to the Volkswagen Golf GTI, Hyundai Veloster N and Subaru WRX. The Corolla GR (the initials stand for Gazoo Racing, which is the automaker’s home-grown performance division) is expected to arrive in 2022. The turbocharged 1.6-liter three-cylinder engine and probable six-speed manual transmission come from the rally-inspired subcompact GR Yaris (not for North America), rated at 257 horsepower and 266 pound-feet of torque. The numbers are likely to carry over to the Corolla GR. Also, the Yaris GR’s all-wheel-drive system isn’t expected to transition into the Corolla. A starting price in the low-$30,000 range is expected.

The Corolla GR will be based on the hatchback and will comewith a 257-horsepower three-cylinder engine and a six-speed manual transmission. Photo: Toyota.

Are you interested in new or used vehicles? Visit TodaysDrive.com today!

Blackwing, fly:

With apologies to the Beatles tune, Blackbird, The Sleuth notes that General Motors’ Cadillac division will use the Blackwing designation for the brand’s top-performing “V” sedans that are due to arrive in late 2020, namely the upcoming CT4-V Blackwing and CT5-V Blackwing. The CT4 version gets a turbo V-6 with an output of about 400 horsepower, while the CT5’s supercharged V-8 could reach 640 horses. There’s no word regarding Blackwing models for any of Cadillac’s utility vehicles, but given that the brand’s key luxury competitors offer higher-output variants of similar vehicles, it’s possible that Blackwing versions for the full range of XT wagons as well as the big Escalade might already be in the planning stages.

Is BMW adding to its X lineup?

That’s what The Sleuth hears is in the works, to be labeled the X8. That makes eight such utility/tall-wagon models, beginning with the X1. The X8 is being designed as a “coupe,” which is essentially a four-door tall-bodied hatchback similar in silhouette to the X4 and X6 models. It’s expected that the new flagship X8 will offer the same turbocharged inline-six-cylinder and V-8 engines as the 8 Series coupe, with output ranging from 335 to 617 horsepower, the latter assigned to a sporty X8 M, which is also expected. A plug-in hybrid model is also likely. At this point, information is sketchy concerning an expected arrival date, but sometime in 2022 seems probable. As for pricing, count on well north of $100,000 in Canada

Mazda’s plans for the Mazda6 revealed:

The Sleuth is hearing that the automaker’s midsize sedan will receive nothing short of a complete makeover for the 2023 model year. The highly touted (by most automotive writers, at least) four-door has been a sluggish seller in a world that’s still in love with utility vehicles. The next Mazda6 will employ a new rear-wheel-drive architecture, replacing the current front-wheel-drive platform. All-wheel-drive will also be available. The new 6’s styling will be inspired by the 2017 Mazda Vision Coupe concept. For thrust, expect an inline six-cylinder gasoline engine and a 48-volt electric-assist motor/generator capable of delivering extra torque when needed. There are rumours of 350 maximum horsepower with this layout, which would likely make the Mazda6 a stellar performer.

Lexus plans a new flagship luxury utility vehicle:

The Sleuth hears there’s a good chance that the sleek LF-1 Limitless concept vehicle that went on display in 2018 will emerge in production form for the 2022 model year wearing the LQ designation. It’s also expected to use the same turbocharged powerplants as the big LS and LS hybrid sedans that make 416 and 354 horsepower, respectively. The arrival of the five-passenger LQ might also mean the retirement of the truck-like eight-passenger LX utility vehicle, although that’s far from certain at this point.

Ups and downs

Up: Music for electric BMWs:

According to a story in the New York Times, film-score composer Hans Zimmer is creating a melodic sound for the BMW’s upcoming i4 electric sedan, which launches for the 2021 model year. By then, European and U.S. regulators will require all electric vehicles (normally silent) to emit noises/sounds to alert pedestrians to their presence. Zimmer has produced music for The Da Vinci Code, Inception, Top Gun (1986), Interstellar, Pirates of the Caribbean and others.

Why just have any sound for the electric BMW i4 when it’s stopped when Hans Zimmer can compose something special. Photo: BMW.

Up: Hybrid Mustang delayed:

Ford is reporting a gasoline-electric power system for the Mustang won’t happen until the start of the 2023 model year, when a next-generation model will roll out. Originally, the option was set to launch later this year for 2021. The Mustang hybrid is said to combine the current 5.0-litre gasoline V-8 with an electric motor at each front wheel.

-written by Wheelbase Media

Like us on Facebook and follow us on Instagram",[]
