,outlet,url,title,authors,publish_date,text,keywords
155,theprogress,https://www.theprogress.com/news/man-found-dead-on-okanagan-trail-identified-as-hollywood-actor/,Man found dead on Okanagan trail identified as Hollywood actor – Chilliwack Progress,['Caitlin Clow'],2020-07-08 14:48:00-07:00,"A GoFundMe campaign has been launched for a man in his 30s, identified as Hollywood actor Josiah Black, who was found dead at the Spion Kop Summit in Lake Country Tuesday, June 16, 2020. (GoFundMe)

A GoFundMe campaign has been started for a man who was found dead along a popular hiking trail in Lake Country on June 16.

The man in his 30s has since been identified as actor Josiah Black, best known for his role in Jigsaw – a 2017 Hollywood film in the Saw franchise.

“It is with a heavy heart that I write, on Monday, June 15, 2020, Josiah Black passed away suddenly and unexpectedly,” fundraiser organizer Jeremiah Black wrote, of the man found at Spion Kop Summit just after 9 a.m., June 16.

He leaves behind his wife, Alicia, and 16-month-old daughter “with another little boy or girl on the way,” the campaign reads.

“Josiah was loved and remembered by many as being a caring, loving father, husband, brother, son and friend to everyone who he came across,” the fundraiser reads. “During Josiah’s final days, he loved spending time outdoors, gardening, reflecting on the words of God, playing with his family, working on his classic VW Westfalia vans and writing through many facets.”

Black had a successful career in acting and stand-up comedy that brought him across North America from Vancouver to Los Angeles.

The GoFundMe campaign, launched June 22, has a $250,000 goal to “offer support, show love and offer encouragement to Josiah’s wife, baby and baby on the way during this difficult and uncertain time.”

“All of the funds dedicated in his name through this page will be offered directly to his family to help them with living expenses in the coming days, weeks, months and years,” Jeremiah Black wrote. “It’s my hope that they will be able to afford a safe home near to family if needed and have enough to put into a college fund for his kids.”

So far, nearly $20,000 has been raised in honour of Black.

READ MORE: Lake Country man found dead at Spion Kop Summit

READ MORE: Missing Lake Country man found safe

@caitleerach

Caitlin.clow@vernonmorningstar.com

Like us on Facebook and follow us on Twitter.

Entertainment",[]
156,theprogress,https://www.theprogress.com/entertainment/harrison-festival-society-unveils-further-summer-lineup/,Harrison Festival Society unveils further summer lineup – Chilliwack Progress,"['Adam Louis', 'Local Entertainment']",2020-07-08 15:00:00-07:00,"Harrison Festival Society is keeping the arts coming this summer, and the community has clearly been thirsty for it.

Though the traditional Festival of the Arts is canceled for this year, the Festival Society has planned a number of cultural events for the near future, beginning with Will’s Jams in honour of the Festival Society’s annual Children’s Day.

There will be three shows on July 15 on Maple Street in Harrison Hot Springs at 11 a.m. , 12:30 p.m. and 2 p.m. Only 50 people will be allowed at any given gathering, which also accounts for the band, crew and volunteers, so space is limited to an audience of 35. Tickets are $6.

RELATED: Harrison Festival Society announces intimate concert series with July 11 show

On Saturday, July 18, learn the secrets of traditional drum making from Darren Charlie of the Sts’ailes First Nation. The class takes place outside Memorial Hall in Harrison Hot Springs.

Charlie’s class will allow participants to create their own drum; the cost of admission depends on the size of drum you wish to make. Prices range from $37 to $182 for drums anywhere from seven inches to 20 inches.

This event will be physically distanced per provincial health guidelines related to COVID-19 and pre-registration is required.

As far as either event is concerned, anyone feeling sick or experiencing symptoms of COVID-19, including coughing, sore throat, fever and shortness of breath, is asked to stay home.

The Harrison Festival Society has had a successful summer so far, given the extreme circumstances brought on by the pandemic. The July 11 concert featuring Bentall Taylor Ulrich – the first of the summer – sold out within 14 hours of announcement.

READ ALSO: Harrison Festival to open with film night for the first time

“We then started to take down names for a wait list,” the most recent statement from the Festival Society reads. “When that list got as big as a full show, we added a third show and most of the tickets went to the people on the wait list. So with only one email and one Facebook post, we have three sold-out shows within just a few days.”

The BTU concert was professionally filmed and will be available soon through the Festival Society’s website.

Will Stroet of Will’s Jams performs interactive rock and pop songs with plenty of kid-friendly wordplay and catchy choruses. His work is famous CBC Kids, Universal Kids TV and children’s music as a whole, spreading positive messages like loving bike riding, cheering for libraries and making a strong case for vegetables.

Stoet is a JUNO nominee and recently released his 10th album, Rocks and Roots, which is nominated for a 2020 CFMA and WCMA. Rocks and Roots celebrates the natural world, outdoor activities and trying new things, hailed as “a masterpiece of creativity and fun, further cementing Will as the ultimate star of children’s rock ‘n’ roll.”

Will’s Jams is found online at www.willsjams.com.

Purchase tickets for both events online at harrisonfestival.com.

The Harrison Festival Society is a consortium of local music and art lovers dedicated to the landmark Festival of The Arts, which was shelved this year due to the pandemic, as well as other events revolving around art, music, performing arts and Harrison Hot Springs. Learn more about them and how you can help at harrisonfestival.com.

Do you have something to add to this story, or something else we should report on? Email:

news@ahobserver.com

Like us on Facebook and follow us on Twitter

Want to support local journalism during the pandemic? Make a donation here.

AgassizHarrison Festival of the ArtsHarrison Hot Springs



Sign up here Get local stories you won't find anywhere else right to your inbox.",[]
157,theprogress,https://www.theprogress.com/entertainment/return-of-the-jedi-and-the-chilliwack-cultural-centre-art-gallery/,Return of the Jedi – and the Chilliwack Cultural Centre art gallery – Chilliwack Progress,"['Jenna Hauck', 'Local Entertainment']",2020-07-08 09:00:00-07:00,"In Dead Soldiers, one of the paintings in the Sandstorm series, Chris Woods alludes to a long tradition of depicting battles in art. (Chris Woods)

People will once again be allowed to visit the O’Connor Group Art Gallery at the Chilliwack Cultural Centre, but only a handful of folks will be allowed in at a time.

After being closed for more than three months, the gallery doors will open today (July 8) for ‘Sandstorm,’ an exhibition by Chilliwack-based artist Chris Woods whose hyper-realistic work takes a look at the original Star Wars trilogy through the eyes of the antagonist Darth Vader.

The huge paintings in this famed series are based on screen captures from the genre-defining sci-fi action films.

Woods goes beyond the ‘good-guy, bad-guy’ Hollywood dichotomy by turning the narrative of the Star Wars trilogy inside out and exploring the idea that Vader’s history of personal trauma, isolation and abuse stands at the root of an adult who never truly had the chance to choose good over evil.

The re-opening of the gallery will limit patrons to five at a time to ensure proper physical distancing. Face masks covering both nose and mouth must be worn at all times by anyone entering the Chilliwack Cultural Centre, and enhanced operating protocol must be followed.

Many of Woods’ other paintings depict his immediate environment: close friends and the consumer landscape composed of malls, fast-food restaurants and 7-Elevens that surrounds them. He uses his friends as subjects, painting them against a backdrop of belligerent branding, pop-culture symbols, and omnipresent advertising.

Woods has exhibited 18 solo shows since 1988, and appeared in numerous group shows in Canada and the United States. His work is held in numerous public and private collections worldwide, and has appeared in Naomi Klein’s book No Logo as well as magazines like Saturday Night and Adbusters.

Sandstorm will be on display in the art gallery from Wednesday, July 8 to Friday, August 17. Gallery hours are from 10 a.m. to 2 p.m., Monday to Friday (closed on holidays). Admission is free.

RELATED: Spotlight on Chilliwack alumni artists at the Hello, Goodbye Mass Reunion

RELATED: Outdoor evening exhibition lights up Chilliwack artist’s property

Do you have something to add to this story, or something else we should report on?

Email: jenna.hauck@theprogress.com

Twitter: @PhotoJennalism

Like us on Facebook and follow us on Twitter.

art exhibit",[]
158,theprogress,https://www.theprogress.com/entertainment/popular-lower-mainland-thanksgiving-festivities-cancelled-by-covid/,Popular Lower Mainland Thanksgiving festivities cancelled by COVID – Chilliwack Progress,['Roxanne Hooper'],2020-07-07 12:00:00-07:00,"Fort Langley’s 25th annual Cranberry Festival put off until 2021, to avoid spread of virus

Food trucks are a big part of the Fort Langley’s annual Cranberry Festival. This would have been year 25, but due to COVID, organizers have announced the 2020 event has been cancelled. Watch for details about the 2021 Thanksgiving celebration. (Langley Advance Times files)

A Thanksgiving tradition that draws tens of thousands of Lower Mainland residents to Fort Langley every fall has been cancelled due to COVID.

Fort Langley’s 25th annual Cranberry Festival – always held on the Saturday of the Thanksgiving Day weekend in October – will not happen as a direct result of the pandemic, said Meghan Neufeld, the former festival coordinator and Fort Langley Business Improvement Area board member.

RELATED – VIDEO: Fort Langley Cranberry Festival rated a ‘huge success’

“This year’s Fort Langley Cranberry Festival was to take place on Saturday, Oct. 10 and would have been the festival’s 25th annual celebration,” she explained.

“Unfortunately, the desire to host the festival, even in an alternate-capacity, did not outweigh the need for public safety and regulatory compliance,” Neufeld said, acknowledging that the streets of Fort Langley are usually packed, shoulder to shoulder with festival goers for the one-day event.

READ MORE – LETTER: Fort Langley festival reminds us to be thankful

Due to the restrictions on gathering sizes limiting both the number of people and number of vehicles, the BIA directors made what she described as “the difficult decision to not proceed with the festival this year.”

The Fort Langley Cranberry Festival has been running since 1996 and has grown into a highly anticipated event of significant size – with more than 60,000 people visiting the village each year for the scheduled festivities.

“While it is disappointing that the event cannot happen this year, the Fort Langley BIA has high hopes that the village will celebrate the festival’s 25th anniversary in 2021,” Neufeld said, encouraging the public to still visit Fort Langley and “explore all it has to offer.”

.

_________________________________

Is there more to this story?

Email: news@langleyadvancetimes.com

Like us on Facebook or follow us on Twitter

_________________________________

FestivalFort Langley",[]
159,theprogress,https://www.theprogress.com/life/victorias-2020-graduates-a-time-to-celebrate/,Victoria’s 2020 Graduates – A Time to Celebrate – Chilliwack Progress,[],2020-06-24 16:12:00-07:00,"Boulevard Cover Shoot Adam Yung, Benjamin Marschman, Isiah Sanchez, Finn Tomer Teja Irvine, Kaitlyn Alerworth Jacklyn Halaburda Elise Neufeld, Paige Cumming, Aleida Ungureanu Drake Erickson Djuna Nagasaki Ella Skillings, Megan Noyce, Julia Johnson

Boulevard congratulates the grads of 2020 on reaching this milestone occasion. We wish them all the best as they pursue their goals and dreams.

Graduation 2020Victoria",[]
160,theprogress,https://www.theprogress.com/life/flight-attendant-to-kelownas-plumbing-queen/,Flight Attendant to Kelowna’s Plumbing Queen – Chilliwack Progress,[],2020-06-09 13:45:00-07:00,"The large home, located on ALR land, is one of the last new mansions to legally be built on ALR land",[]
161,theprogress,https://www.theprogress.com/life/blvd-tv-interviews-jason-binab-from-the-agency-victoria/,BLVD TV Interviews Jason Binab from the Agency Victoria – Chilliwack Progress,[],2020-05-19 09:00:00-07:00,"The large home, located on ALR land, is one of the last new mansions to legally be built on ALR land",[]
162,theprogress,https://www.theprogress.com/life/when-long-time-chef-nicholas-waters-first-started-toque-catering-in-2013-he-never-expected-it-to-take-off/,"When long-time chef Nicholas Waters first started Toque Catering in 2013, he never expected it to take off – Chilliwack Progress",[],2020-05-08 08:00:00-07:00,"Desert sample from Toque Catering Photos by Lia Crowe Meal example from Toque Catering Photos by Lia Crowe Meal example from Toque Catering

When long-time chef Nicholas Waters first started Toque Catering in 2013, he never expected it to take off.

“To be honest, I thought I’d be doing one function a weekend,” he says with a laugh. “I didn’t think anything of it. Then all of a sudden, it turned into an animal.”

Toque grew from just five full-timers three years ago to a staff almost 30 strong today, and the wealth of talent in Nick’s kitchen is enviable.

“We run with 10 to 12 executive chefs full time in the kitchen,” he says. “It’s one of the best teams I’ve ever worked with.”

About the same time Toque took off, Nick relocated to Metchosin, and the locale has been ideal both personally and professionally.

“The bigger we’ve gotten, the more local we’ve become,” he says.

Toque is booked at least a year in advance, so Nick and his team have been able to approach local farmers well ahead of season to plan out orders, translating to reliable income for the small agriculture sector, as well as premium ingredients.

And though Nick says he doesn’t want to grow too big too fast, there are definitely some new and exciting directions coming down the pipe.

“Stay tuned!”

The 7 Sins

Envy:

Whose shoes would you like to walk in?

I am on my own journey in life and wouldn’t change a thing, good or bad, but I would love to be Michel Bras in Normandy, France for a day. He has been my favourite chef in the world since I was 18! His book is still better than most out there and it’s almost 20 years old.

Gluttony:

What is the food you could eat over and over again?

That is definitely a hard one, but I would say gyoza. No matter whether I’m at a pub, home or a high-end restaurant, 10 out of 10 times I will order it if it’s on the menu.

Greed:

You’re given $1 million that you have to spend selfishly. What would you spend it on?

I would travel all through Europe and eat and drink and just eat and drink until it was gone. Spain, Portugal, France, Italy — let’s face it, the money would be gone by then!

wrath:

Pet Peeves?

Everything, almost … but the freezers and coolers being a mess has to be the one that makes me think I’m going to have a heart attack.

sloth:

Where would you spend a long time doing nothing?

Spain.

Pride:

What is the one thing you’re secretly proud of?

It won’t be a secret anymore if I say this, but it would be the team — chefs, dishwashers, operations, planners, on-site service staff, rentals and anyone else I’m missing — and the culture we’ve been able to create at Toque. I am grateful every day that I get to work alongside a very, very talented group. I actually like working with them all and don’t have a bad thing to say. They’ve all become my family.

Lust:

What makes your heart beat faster?

Being on-site when shit hits the fan — like a barbecue falls off the top and an oven doesn’t work, etc. That shit turns me on when you come out of it unscathed and everything went perfectly, except your soul becomes a little darker!

I love the unknown and being able to make something out of nothing. The best was four or five years ago when the guys got me an Easy-Bake Oven for Christmas. They said, “Well, it’s on. Let’s see what you can do with this!’”

Food",[]
163,theprogress,https://www.theprogress.com/marketplace/experience-bcs-northern-wild-nature-on-a-whole-new-scale/,"Experience BC’s Northern Wild, Nature on a Whole New Scale – Chilliwack Progress",[],2020-07-06 06:00:00-07:00,"If you’re looking for perspective, connection with nature, and space to roam, look to our province’s vast and wild northern reaches. Discover glacial valleys, soaring mountain peaks, and wildlife parks – the kind of sweeping landscapes that adventurers aspire to witness.

Regardless of how far from home or enormous these parts may appear, the wilderness in BC’s north is as inviting as it is untamed. You’ll feel right at home when you arrive, and will leave with a new understanding of just how deep BC’s beautiful backyard goes.

Ways to Explore the Vast, Wild North

Tour by car or RV along key corridors like the scenic Route 16 through Smithers and Terrace, forest-lined Highway 37, or the historic Alaska Highway. Or, link them all for the ultimate northern circle route.

Edged by jaw-dropping scenery, Prince George is a great place to stay a few days and get a taste of life in the north. Meet the locals and enjoy a glass of fruit wine at BC’s northernmost winery; walk amongst 300-year-old black cottonwoods and view tree bark carvings in Cottonwood Island Park. Discover secluded waterways of the Omineca with a guided fishing charter.

For a more direct route from the south, fly direct to Terrace or Prince George.

Enjoy Heart-Pumping Adventures Along Route 16

Give your northern adventure a theme and go on a fishing, rafting, mountain biking, or hiking road trip along Route 16. Head west from Prince George and spend a few days in towns like Terrace, BC’s up-and-coming mountain biking hotspot. Set up a home base in Burns Lake or Smithers and explore the dozens of lakes and rivers in the area – full of healthy populations of rainbow trout and char, so don’t forget your fishing licence! Visit the Hazeltons and the ‘Ksan Historical Village, Campground and Museum to honour generations, past and present, and immerse yourself in 8,000-year-old Indigenous history.

Explore northern BC’s majestic vistas, like Monkman Provincial Park. Mike Seehagel photo.

Explore Big Nature East of the Rockies in “The Peace”

Carved by water and wind over thousands of years, mountain ranges give way to valleys and prairie skies east of the Rockies along the Alaska Highway (Highway 97) – an area affectionately dubbed “The Peace” by locals.

This historic route leads you to old settlements like Fort St. John and “Mile 0” of the Alaska Highway at Dawson Creek. Tumbler Ridge, one of only three Global Geoparks in North America, is another must-visit; see dinosaur trackways and fossils and appreciate just how far travel in BC can take us, in both space and through time. Continue onward to Fort Nelson and explore Stone Mountain and Northern Rocky Mountains provincial parks and make a stop at the picturesque Muncho Lake.

Start planning your summer travel today at ExploreBC.com.

adrenalineBritish ColumbiaCanadaDBC Northern WildFamily activitiesfishingHeritageHikingMountain bikingRoadtripStaycation secrets",[]
164,theprogress,https://www.theprogress.com/marketplace/rivers-ranches-and-ranges-from-historic-sites-to-wilderness-adventure/,"Rivers, Ranches and Ranges: From Historic Sites to Wilderness Adventure – Chilliwack Progress",[],2020-07-06 06:00:00-07:00,"Wedged between the Coast Mountains and the Rockies, BC’s interior puts you at a crossroads of sweeping ranchlands, grassy vistas, and golden plateaus. And that’s just the landscape. There is a rich history here, too, from the Indigenous peoples whose stories, traditions, and stewardship of the land span millennia, to the ranchers, gold prospectors, and adventurers who braved unknown wilderness to traverse rough terrain and uncharted waterways.

Challenge yourself to try something new and experience some of BC’s history this summer through guest ranch stays, cultural tours, museum visits, guided trips into the backcountry, and more.

Drive Through Historic Gold Rush Country

Follow in the footsteps of 1860s Gold Rush prospectors and see how the mighty Fraser River shaped life in these parts. From Kamloops, head west toward Lillooet and “Mile 0” of the historic Cariboo Wagon Road. Visit sites ranging from preserved road houses to ghost towns and connect with locals in small towns along the way. Travel as far as Barkerville Historic Town, which brings this era to life with a restored townsite and costumed interpreters, and en route discover a vital Indigenous culture that dates back thousands of years.

The quintessential guest ranch experience awaits in the Cariboo and Chilcotin. Blake Jorgenson photo.

Stay at a Guest Ranch

If you’ve dreamed of long trail rides through peaceful pastures or into meadows bursting with wildflowers, consider a stay at one of BC’s many guest ranches, most of which are found in the Cariboo and Chilcotin. The quintessential guest ranch experience is, of course, riding the range, but when you need a break from the saddle, the possibilities are many. Whether you’re looking for a true cowboy experience (think: corralling livestock or mucking out stalls) or something a little less rugged (a day at the onsite spa, anyone?), you’ll find freedom and adventure in the wide-open spaces.

Cast a line in calm lakes and fast-moving rivers, hike into the mountains for expansive views, or stick close to the ranch – and to the cowboy theme – with wagon rides, lasso throwing, and, of course, tall tales around a campfire under a clear, starry sky.

Find Adventure in the Wild

With wide-open spaces come wide-open opportunities for adventure. The lakes and rivers of BC’s interior beckon with more places to fish than you can experience in a lifetime. There are calm waters for paddling – including multi-day wilderness canoe routes – and there are stretches of thrilling whitewater for adrenaline junkies. You can fly into the backcountry for some hardcore hiking and mountain biking from an alpine basecamp or saddle up for an off-the-grid horse-packing trip. Whichever option you choose, keep your camera close as you’re very likely to spot some of BC’s four-legged residents along the way.

Start planning your summer travel today at ExploreBC.com

British ColumbiaChilcotinDBC Rivers Ranches RangesGuest RanchHeritageHikingMountain bikingPaddling",[]
