,outlet,url,title,authors,publish_date,text,keywords
29,nationalpost,http://nationalpost.sportstonews.com/2020/04/21/schupak-the-world-golf-hall-of-fame-didnt-need-another-administrator-2/,Schupak: The World Golf Hall of Fame didn’t need another administrator,['Adam Schupak'],2020-04-21,"It’s a good year for retired Commissioners of sports leagues. First, Paul Tagliabue, who ran the NFL for 17 years, was elected to the Pro Football Hall of Fame’s Class of 2020 in Canton, Ohio. It took 10 years and a one-time only expanded class for the NFL’s 100th-year celebration to get across the goaline. Tim Finchem didn’t have to sweat out “golf’s highest honor.” He was a first-ballot guy as a finalist, just like his fellow Class of 2021 inductee, Tiger Woods.

“To be included in that group is very powerful,” Finchem said in a press conference on Monday of being elected in the “contributor category” to join the World Golf Hall of Fame in St. Augustine, Florida. “I want to certainly thank those that thought that I was deserving of it. I kind of in many ways don’t feel like I am deserving because I just had so much fun being in the job for so long. It was absolutely captivating for me year after year after year.”

Finchem isn’t the only one who doesn’t think he’s deserving. Social media was not kind when the announcement was made this morning.

it’s ridiculous. he happened to be sitting there when Tiger arrived and just got swept up in the hurricane. A rubber tree plant could’ve done that. — Rick Reilly (@ReillyRick) April 20, 2020

And why should they be? Just days ago, my colleague Beth Ann Nichols and others applauded the World Golf Hall of Fame for finally electing Marion Hollins also through the contributor category. (Quick aside: If the Hall is going to continue with this category, please at least limit it to a max of one per induction.) Hollins was a trailblazer and while her inclusion won’t send people turning off I-95 at International Golf Parkway in droves, hopefully some of those visitors who spring for a ticket to go and see the locker for Tiger Woods will learn her story too.

But the World Golf Hall of Fame needed another plaque of an administrator about as much as it needed one for Augusta National chairman Billy Payne two years ago. This isn’t so much a knock on Finchem as much as a wider complaint that we’re honoring the wrong people. The Hall of Fame should be for the greats of the game, the players who achieved the moments etched in our memory. There is still one more inductee to be named later this week, but all of the other players who will be left on the outside looking in are far more deserving of recognition in the Hall of Fame than Finchem.

He led the PGA Tour through very prosperous times during his 22-year tenure that began in 1994 after Deane Beman passed him the baton, but Finchem’s been richly rewarded for it. According to the Tour’s 2017 Form 990, he earned $12 million and another $6 million in reportable compensation from related organizations.

“Deane’s left him a Mercedes with the tank a quarter full, and all Tim has to do is keep putting gas in it,” Tour pro Peter Jacobsen once said.

That is an oversimplification, of course, but best I can tell Finchem wisely followed the Deane Beman playbook and had the good fortune of having Tiger, the world’s most famous athlete, come along and lift the sport to new heights during his tenure. As Beman used to say during his good years, “we’re not selling here, we’re enrolling.” (Last side note: Beman, Michael Bonallack of the R&A, and former USGA president Bill Campbell, who are all previously inducted, could have earned this distinction for their amateur record alone.) I’m not saying Finchem had an easy job, but it would have been hard to fail at the job with Tiger and an ever-expanding TV contract.

Former PGA Tour commissioner Tim Finchem will be inducted into the Golf Hall of Fame next year with Tiger. Fitting that he rides on Tiger’s coattails one last time. — Robert Lusetich (@RobertLusetich) April 20, 2020

Even Finchem conceded as much when he told the following story about Tiger.

“There was some magazine that ranked me in the top 10 or 20 powerful people in sports one year. Obviously a lousy magazine. But people called me to say, what do you think?” Finchem recounted. “Well, I’m not — you know, the person that’s the most powerful person in sports is Tiger Woods, and they said, what do you mean by that. I said, well, I’ll give you an example. If I wanted to convey something, we’re building a tournament in Tokyo or something, I wanted to convey some information, I’d have to spend a week getting people charged up figuring out some communications, who are the people we have to go to to get this message across, this, that and the other. Tiger Woods doesn’t have to do any of that. Tiger Woods, all he has to do is issue a little statement, and his name is on it, Tiger Woods, everybody in the world knows about it. And to me, that’s real power. That is real power.”

And when asked about how much more difficult a job it would have been without Tiger, Finchem channeled his inner Captain Obvious and said, “It would have been a much more difficult job.”

You don’t say? Give Finchem a gold watch on the way out the door for a job well done and I’m OK if you want to let him continue as a board member of The First Tee. But membership in the World Golf Hall of Fame should be sacred. His election further validates claims that it is merely a popularity contest and charges of cronyism. (PGA Tour Commissioner Jay Monahan, who was Finchem’s handpicked successor, and other leaders in the game whose chances of being honored in the future probably also improved with Finchem’s election are among the voters. It all adds up to too much potential conflict of interest.) Interestingly, Finchem was a semi-finalist in 2019 and didn’t even make it to the list of finalists. It makes you wonder what changed in the last two years during his retirement. But his election is just another reason why the number of members returning for the ceremony is often low and why Hall of Famers continue to give their best mementos elsewhere. The last thing it needed was to enshrine another administrator, even if Finchem says he has a great letter from Arnold Palmer that he will donate to his exhibit along with some photographs of the greats that he bumped elbows with – from Gene Sarazen to Tiger.

When asked if he felt administrators should be honored at the Hall of Fame, Finchem demurred. “I’m not going to comment on that now, but when I speak at the induction, I will comment on it. I’m not trying to be cagey, but I’d just prefer to do it that way.”

I’ll save his speech writer some time. He’s going to say that it’s an honor to be recognized but the players are the real heroes and that he and his fellow administrators just support them. And people will clap politely and then we’ll move on to the induction of Tiger and the next time some guest says they want to see Finchem’s plaque will be the first time, but he’ll be housed there all the same between Nick Faldo and Raymond Floyd.

But as long as the Finchem’s of the industry continue to be enshrined, “golf’s highest honor” will remain just what it is – another empty slogan.",[]
30,nationalpost,http://nationalpost.sportstonews.com/2020/04/21/schupak-the-world-golf-hall-of-fame-didnt-need-another-administrator/,Schupak: The World Golf Hall of Fame didn’t need another administrator,['Adam Schupak'],2020-04-21,"It’s a good year for retired Commissioners of sports leagues. First, Paul Tagliabue, who ran the NFL for 17 years, was elected to the Pro Football Hall of Fame’s Class of 2020 in Canton, Ohio. It took 10 years and a one-time only expanded class for the NFL’s 100th-year celebration to get across the goaline. Tim Finchem didn’t have to sweat out “golf’s highest honor.” He was a first-ballot guy as a finalist, just like his fellow Class of 2021 inductee, Tiger Woods.

“To be included in that group is very powerful,” Finchem said in a press conference on Monday of being elected in the “contributor category” to join the World Golf Hall of Fame in St. Augustine, Florida. “I want to certainly thank those that thought that I was deserving of it. I kind of in many ways don’t feel like I am deserving because I just had so much fun being in the job for so long. It was absolutely captivating for me year after year after year.”

Finchem isn’t the only one who doesn’t think he’s deserving. Social media was not kind when the announcement was made this morning.

it’s ridiculous. he happened to be sitting there when Tiger arrived and just got swept up in the hurricane. A rubber tree plant could’ve done that. — Rick Reilly (@ReillyRick) April 20, 2020

And why should they be? Just days ago, my colleague Beth Ann Nichols and others applauded the World Golf Hall of Fame for finally electing Marion Hollins also through the contributor category. (Quick aside: If the Hall is going to continue with this category, please at least limit it to a max of one per induction.) Hollins was a trailblazer and while her inclusion won’t send people turning off I-95 at International Golf Parkway in droves, hopefully some of those visitors who spring for a ticket to go and see the locker for Tiger Woods will learn her story too.

But the World Golf Hall of Fame needed another plaque of an administrator about as much as it needed one for Augusta National chairman Billy Payne two years ago. This isn’t so much a knock on Finchem as much as a wider complaint that we’re honoring the wrong people. The Hall of Fame should be for the greats of the game, the players who achieved the moments etched in our memory. There is still one more inductee to be named later this week, but all of the other players who will be left on the outside looking in are far more deserving of recognition in the Hall of Fame than Finchem.

He led the PGA Tour through very prosperous times during his 22-year tenure that began in 1994 after Deane Beman passed him the baton, but Finchem’s been richly rewarded for it. According to the Tour’s 2017 Form 990, he earned $12 million and another $6 million in reportable compensation from related organizations.

“Deane’s left him a Mercedes with the tank a quarter full, and all Tim has to do is keep putting gas in it,” Tour pro Peter Jacobsen once said.

That is an oversimplification, of course, but best I can tell Finchem wisely followed the Deane Beman playbook and had the good fortune of having Tiger, the world’s most famous athlete, come along and lift the sport to new heights during his tenure. As Beman used to say during his good years, “we’re not selling here, we’re enrolling.” (Last side note: Beman, Michael Bonallack of the R&A, and former USGA president Bill Campbell, who are all previously inducted, could have earned this distinction for their amateur record alone.) I’m not saying Finchem had an easy job, but it would have been hard to fail at the job with Tiger and an ever-expanding TV contract.

Former PGA Tour commissioner Tim Finchem will be inducted into the Golf Hall of Fame next year with Tiger. Fitting that he rides on Tiger’s coattails one last time. — Robert Lusetich (@RobertLusetich) April 20, 2020

Even Finchem conceded as much when he told the following story about Tiger.

“There was some magazine that ranked me in the top 10 or 20 powerful people in sports one year. Obviously a lousy magazine. But people called me to say, what do you think?” Finchem recounted. “Well, I’m not — you know, the person that’s the most powerful person in sports is Tiger Woods, and they said, what do you mean by that. I said, well, I’ll give you an example. If I wanted to convey something, we’re building a tournament in Tokyo or something, I wanted to convey some information, I’d have to spend a week getting people charged up figuring out some communications, who are the people we have to go to to get this message across, this, that and the other. Tiger Woods doesn’t have to do any of that. Tiger Woods, all he has to do is issue a little statement, and his name is on it, Tiger Woods, everybody in the world knows about it. And to me, that’s real power. That is real power.”

And when asked about how much more difficult a job it would have been without Tiger, Finchem channeled his inner Captain Obvious and said, “It would have been a much more difficult job.”

You don’t say? Give Finchem a gold watch on the way out the door for a job well done and I’m OK if you want to let him continue as a board member of The First Tee. But membership in the World Golf Hall of Fame should be sacred. His election further validates claims that it is merely a popularity contest and charges of cronyism. (PGA Tour Commissioner Jay Monahan, who was Finchem’s handpicked successor, and other leaders in the game whose chances of being honored in the future probably also improved with Finchem’s election are among the voters. It all adds up to too much potential conflict of interest.) Interestingly, Finchem was a semi-finalist in 2019 and didn’t even make it to the list of finalists. It makes you wonder what changed in the last two years during his retirement. But his election is just another reason why the number of members returning for the ceremony is often low and why Hall of Famers continue to give their best mementos elsewhere. The last thing it needed was to enshrine another administrator, even if Finchem says he has a great letter from Arnold Palmer that he will donate to his exhibit along with some photographs of the greats that he bumped elbows with – from Gene Sarazen to Tiger.

When asked if he felt administrators should be honored at the Hall of Fame, Finchem demurred. “I’m not going to comment on that now, but when I speak at the induction, I will comment on it. I’m not trying to be cagey, but I’d just prefer to do it that way.”

I’ll save his speech writer some time. He’s going to say that it’s an honor to be recognized but the players are the real heroes and that he and his fellow administrators just support them. And people will clap politely and then we’ll move on to the induction of Tiger and the next time some guest says they want to see Finchem’s plaque will be the first time, but he’ll be housed there all the same between Nick Faldo and Raymond Floyd.

But as long as the Finchem’s of the industry continue to be enshrined, “golf’s highest honor” will remain just what it is – another empty slogan.",[]
31,nationalpost,http://nationalpost.sportstonews.com/2020/04/21/19th-hole-world-golf-hall-of-fame-has-its-blind-spots-but-tim-finchem-isnt-one-of-them-2/,"19th hole: World Golf Hall of Fame has its blind spots, but Tim Finchem isn’t one of them",['Eamon Lynch'],2020-04-21,"For everything that has been denied golf fans in this period of quarantine —access to courses for many, the Masters for all, freedom from Peloton updates for an unlucky few — one thing remains soothingly constant among the social media commentariat: begrudgery.

That much was evident with the news that former PGA Tour commissioner Tim Finchem will join Tiger Woods and Marion Hollins in the next class to be inducted into the World Golf Hall of Fame. The announcement was greeted with griping that was as predictable as it is tedious, an exercise in collective eye-rolling intended to suggest not only that Finchem is undeserving but that his inclusion dilutes the Hall’s credibility.

That argument is familiar and has been leveled against more deserving targets who got a call to the Hall, like George H.W. Bush, Bing Crosby or Bob Hope. But there’s no sound basis for raising it against Finchem.

There is a sentiment that says lockers in St. Augustine ought to be earned for exploits on the field of play, and the only field of play that matters is a golf course. Not a boardroom or a factory or a production trailer or a media center. It’s an absolutist position that would disqualify plenty of current Hall of Famers.

Like C.B. Macdonald or Pete Dye, who only designed those fields of play,

Like Karsten Solheim, who innovated the instruments used on those fields.

Like Dan Jenkins or Herb Graffis, whose only mastery was of a typewriter on the sidelines.

The reality is that most sports halls of fame are intended to acknowledge not just quantifiable achievement but immeasurable impact. Charlie Sifford wasn’t inducted for his two PGA Tour victories but for what his presence, courage and determination symbolized in golf’s ugliest era. Frank Chirkinian wasn’t given a locker to store his Emmy awards, but because the legendary CBS producer’s influence far exceeded that of most players he put on living room TVs.

It’s why the football and tennis Halls have “contributor” categories to enshrine non-players, and it’s why the golf Hall is welcoming Finchem, just as it did his predecessor Deane Beman, Augusta National’s Billy Payne and the European Tour’s Ken Schofield before him.

This is hardly to say Finchem is beyond criticism. He forged a colorless culture at Tour HQ and enforced a level of secrecy around disciplinary proceedings and drug testing that would have been envied in Pyongyang. But it can’t be argued that he didn’t leave the Tour in a considerably better place than he found it.

When he took over as commissioner in 1994, total prize money on Tour was $56.4 million. Toss in the Champions and then-Web.com Tours and the fund was just over $90 million. This season the Tour’s prize money is nearing $400 million, before bonuses at least until COVID-19 upended things. He created the oft-maligned World Golf Championship events, which if nothing else helped temper Greg Norman’s plans for world domination, and the FedEx Cup playoff system 13 years ago.

It’s a popular though specious suggestion that Finchem owes his success to coat-tailing on Tiger Woods. Sure, he was dealt a strong hand, but he played it well for what was demanded of him. If subsisting on crumbs from Tiger’s table was sufficient to earn a spot in the Hall, then Mark Steinberg would have his own wing.

Arguing over Hall of Fame inductees is a staple of most every sport, moreso during a quarantine when we’re happy for any meat to chew on, no matter how lacking in nutrition it is. And golf’s Hall has richly deserved much of the criticism it has received over the years. The last class inducted Peggy Kirk Bell. The famed teacher was eminently worthy, but she was deserving of the honor when she was alive. She lived for 95 years, but the Hall only saw fit to induct her three years after her death. That kind of standard can’t be encouraging to others who deserve a spot and have been thus far denied, like Tom Weiskopf or Butch Harmon.

There are obvious shortcomings surrounding golf’s Hall of Fame. There are those who deserve the honor who have been overlooked and those who’ve been given a spot they didn’t merit. But whatever his failings, Tim Finchem doesn’t belong on either list.",[]
32,nationalpost,http://nationalpost.sportstonews.com/2020/04/21/19th-hole-world-golf-hall-of-fame-has-its-blind-spots-but-tim-finchem-isnt-one-of-them/,"19th hole: World Golf Hall of Fame has its blind spots, but Tim Finchem isn’t one of them",['Eamon Lynch'],2020-04-21,"For everything that has been denied golf fans in this period of quarantine —access to courses for many, the Masters for all, freedom from Peloton updates for an unlucky few — one thing remains soothingly constant among the social media commentariat: begrudgery.

That much was evident with the news that former PGA Tour commissioner Tim Finchem will join Tiger Woods and Marion Hollins in the next class to be inducted into the World Golf Hall of Fame. The announcement was greeted with griping that was as predictable as it is tedious, an exercise in collective eye-rolling intended to suggest not only that Finchem is undeserving but that his inclusion dilutes the Hall’s credibility.

That argument is familiar and has been leveled against more deserving targets who got a call to the Hall, like George H.W. Bush, Bing Crosby or Bob Hope. But there’s no sound basis for raising it against Finchem.

There is a sentiment that says lockers in St. Augustine ought to be earned for exploits on the field of play, and the only field of play that matters is a golf course. Not a boardroom or a factory or a production trailer or a media center. It’s an absolutist position that would disqualify plenty of current Hall of Famers.

Like C.B. Macdonald or Pete Dye, who only designed those fields of play,

Like Karsten Solheim, who innovated the instruments used on those fields.

Like Dan Jenkins or Herb Graffis, whose only mastery was of a typewriter on the sidelines.

The reality is that most sports halls of fame are intended to acknowledge not just quantifiable achievement but immeasurable impact. Charlie Sifford wasn’t inducted for his two PGA Tour victories but for what his presence, courage and determination symbolized in golf’s ugliest era. Frank Chirkinian wasn’t given a locker to store his Emmy awards, but because the legendary CBS producer’s influence far exceeded that of most players he put on living room TVs.

It’s why the football and tennis Halls have “contributor” categories to enshrine non-players, and it’s why the golf Hall is welcoming Finchem, just as it did his predecessor Deane Beman, Augusta National’s Billy Payne and the European Tour’s Ken Schofield before him.

This is hardly to say Finchem is beyond criticism. He forged a colorless culture at Tour HQ and enforced a level of secrecy around disciplinary proceedings and drug testing that would have been envied in Pyongyang. But it can’t be argued that he didn’t leave the Tour in a considerably better place than he found it.

When he took over as commissioner in 1994, total prize money on Tour was $56.4 million. Toss in the Champions and then-Web.com Tours and the fund was just over $90 million. This season the Tour’s prize money is nearing $400 million, before bonuses at least until COVID-19 upended things. He created the oft-maligned World Golf Championship events, which if nothing else helped temper Greg Norman’s plans for world domination, and the FedEx Cup playoff system 13 years ago.

It’s a popular though specious suggestion that Finchem owes his success to coat-tailing on Tiger Woods. Sure, he was dealt a strong hand, but he played it well for what was demanded of him. If subsisting on crumbs from Tiger’s table was sufficient to earn a spot in the Hall, then Mark Steinberg would have his own wing.

Arguing over Hall of Fame inductees is a staple of most every sport, moreso during a quarantine when we’re happy for any meat to chew on, no matter how lacking in nutrition it is. And golf’s Hall has richly deserved much of the criticism it has received over the years. The last class inducted Peggy Kirk Bell. The famed teacher was eminently worthy, but she was deserving of the honor when she was alive. She lived for 95 years, but the Hall only saw fit to induct her three years after her death. That kind of standard can’t be encouraging to others who deserve a spot and have been thus far denied, like Tom Weiskopf or Butch Harmon.

There are obvious shortcomings surrounding golf’s Hall of Fame. There are those who deserve the honor who have been overlooked and those who’ve been given a spot they didn’t merit. But whatever his failings, Tim Finchem doesn’t belong on either list.",[]
33,nationalpost,http://local.nationalpost.com/toronto-on/forest-hill-real-estate-julie-gofman-team-416-488-2875,Forest Hill Real Estate,[],,"About Toronto's most luxurious real estate brokerage using the most advanced cutting-edge of technology. Forest Hill Real Estate prides itself on our strong history, reputation of integrity, customer service and market expertise.",[]
34,nationalpost,http://local.nationalpost.com/ottawa-on/mtis-national-council-613-232-3216,Métis National Council,[],,"About The Métis National Council reflects and moves forward on the desires and aspirations of the Métis Nation governments at a national and international level. Overall, the Métis National Council's central goal is to secure a healthy space for the Métis Nation's on-going existence within the Canadian federation. The Métis emerged as a distinct Indigenous people and nation in the historic Northwest during the late 18th century. The historic Métis Nation Homeland encompasses the Prairie Provinces of Manitoba, Saskatchewan and Alberta and extends into contiguous parts of Ontario, British Columbia, the Northwest Territories and the northern United States. In 1870 the Métis Provisional Government of Louis Riel negotiated the entry of the Red River Settlement into Confederation as the Province of Manitoba. The Métis Nation is represented at the national and international levels by the Métis National Council which receives its mandate and direction from its Governing Members, the democratically elected governments of the Métis Nation within the five westernmost provinces.",[]
35,nationalpost,http://local.nationalpost.com/toronto-on/soho-hotel-and-residences-toronto-416-599-8800,SoHo Hotel & Residences Toronto,[],,"About Stay in the heart of Torontos entertainment district and experience exquisite services, state-of-the-art features, and luxurious accommodations at The SoHo Hotel & Residences.",[]
