,outlet,url,title,authors,publish_date,text,keywords
47,nationalpost,http://local.nationalpost.com/new-westminster-ca-bc/landquest-realty-corporation-866-558-5263/2020-07-09-11200576-marketing-british-columbia-to-the-world-www-dot-landquest-dot-com-landquest-rea-lty-corp-shuswap-lakes-most-hard-rock-quarry-affordable-ranch-with-views-near-lakefront-gem-in-the-kootenays-serviced-lot-on-upper-arrow-lake-oceanfront-hom,LandQuest Realty Corporation,[],2020-07-09,"Marketing British Columbia to the World www.landquest.com LANDQUEST REA LTY CORP. SHUSWAP LAKE'S MOST HARD ROCK QUARRY AFFORDABLE RANCH WITH VIEWS NEAR LAKEFRONT GEM IN THE KOOTENAYS SERVICED LOT ON UPPER ARROW LAKE OCEANFRONT HOME & DOCK FRANCOIS LAKE - BURNS LAKE, BC PRIVATE FAMILY COMPOUND PRINCE RUPERT, BC BOULDER POINT - CORTES ISLAND Escape the city to this super private 62 135 acre quarry with 300+ million tonnes 640 acres in 5 titles. Fenced and cross Large building Lot (0.9 acres) in Galena Shores Stunning 9.88 acre oceanfront with acres. 1,750 feet of amazing beachfront on of hard rock on Highway 16 & adjacent CN fenced. Supports 100 cow/ calf pairs and 100 lon Upper Amow Lake. Lot and location is ideal 1.500 t of frontage overlooking Squirel Cove the crystal clear waters of Beach Bay. Totally Railway near the Port of Prince Rupert. self-sufficient with Pelton Wheel hydro power, Things are happening in Prince Rupert 120 acres of hayfield yielding 130 tons of hay. fishing and year-round recreation in area. lyear-round protected moorage & a newly built solar & generator. 3,500 home. Pan-Abode expansion of the Prince Rupert Container 2.992 fe main house. Many outbuildings. Serviced with underground power, telephone, west coast contemporary home. Only a few cabin, summer kitchen, 2 additional cabins, Port, projects on Ridley Island & Watson Fully serviced. Picturesque views. $519,000 water and sewer. $199,000 bathhouse, shed & Quonset. $2,100,000 goats. Grazing Licence for 40 cow / calf pairs. for a cabin or year cound living. Great boating. & Protection Island. 30 ft licensed dock with minutes boat ride from government wharf Igeneral store & Desolation Sound. $749,000 Island, double-tracking the CNR. $3,950.000 RICHARD OSBORNE 604-664-7633 RICHARD OSBORNE 604-664-7633 SAM HODSON 604-694-7623 MATT CAMERON 250-200-1199 JAMIE ZROBACK 1404-483-1605 Personal Real Estate Corporation richalandquest.com Personal Real Estate Corporation richalandquest.com Personal Real Estate Corporation samalandquest.com mattelandquest.com JASON ZROBACK 1404-414-5577 OCEANFRONT HIDEAWAY RARE PRIVATE ISLAND WITH LOG CABIN 75 ACRES OF FLAT FARMLAND ALONG PICTURESQUE HORSE PROPERTY ""TAKE IT EASY"" AT EAGLE BAY ON STUART LAKE - FORT ST. JAMES, BC DE COURCY ISLAND, BC THE NORTH THOMPSON RIVER PABLO CREEK - WILLIAMS LAKE, BC Three separate 1.5 acre southwest facing low Rare & affordable opportunity to purchase Clearwater, BC. Scenic farm property along There are options on this south Shuswap 2,088 ft 3 bdm, 3 bath rancher on 186 bank oceanfront lots with approx. 669 t of your very own 100% private island on scenic the banks of the North Thompson River. 75 property; outstanding lake view estate, waterfront. Architecturally designed, custom Stuart Lake. This 20 acre island offers a Jacres with a 4 bdrm bungalow, direct road group purchase and subdivision opportunity. pond, surrounded by fruit trees, wildlife buit 1,610 home with studio on centre lot. cozy 480 f log cabin with woodstove. The trontage & 56 acres of flat fertile hay land. Privacy assured or flexibility to hand pick your shorelines are gentle & shalow, perfect for Great option for existing farmers or someone neighbours. Well-appointed for year-round mooring a boat. The beaches provide plenty of looking for a change of pace. Averaging Joffer fantastic views. Water rights in 2 building site with services, de-activated air living. NEW PRICE $769,000 acres just 15 mins from Williams Lake. Large Access to a nice beach for recreation & commanding views. Large horse barn, and boat moorage. Several terraces numerous corrals, fenced & crossed fenced. southem exposure. NEW PRICE $175.000 250 - 300 bales with no imigation. $50,000 place. NEW PRICE S50,000 strip and more. Must see property! $777,000 JOHN ARMSTRONG 250-307-2100 FAWN GUNDERSON 250-982-2314 JAMIE ZROBACK 1-604-483-1605 CHASE WESTERSUND 778-927-634 COLE WESTERSUND 604-360-4793 COLE WESTERSUND 604-360-0793 johnalandquest.com LandQuest"" Realty Corp Cariboo Personal Real Estate Corporation JASON ZROBACK 1404-414-5S77 CHASE WESTERSUND 778-927-4634 fawnltandquest.com ""The Source"" for Oceanfront, Lakefront, Islands, Ranches, Resorts & Land in BC f Toll Free 1-866-558-LAND (5263) Marketing British Columbia to the World www.landquest.com LANDQUEST REA LTY CORP. SHUSWAP LAKE'S MOST HARD ROCK QUARRY AFFORDABLE RANCH WITH VIEWS NEAR LAKEFRONT GEM IN THE KOOTENAYS SERVICED LOT ON UPPER ARROW LAKE OCEANFRONT HOME & DOCK FRANCOIS LAKE - BURNS LAKE, BC PRIVATE FAMILY COMPOUND PRINCE RUPERT, BC BOULDER POINT - CORTES ISLAND Escape the city to this super private 62 135 acre quarry with 300+ million tonnes 640 acres in 5 titles. Fenced and cross Large building Lot (0.9 acres) in Galena Shores Stunning 9.88 acre oceanfront with acres. 1,750 feet of amazing beachfront on of hard rock on Highway 16 & adjacent CN fenced. Supports 100 cow/ calf pairs and 100 lon Upper Amow Lake. Lot and location is ideal 1.500 t of frontage overlooking Squirel Cove the crystal clear waters of Beach Bay. Totally Railway near the Port of Prince Rupert. self-sufficient with Pelton Wheel hydro power, Things are happening in Prince Rupert 120 acres of hayfield yielding 130 tons of hay. fishing and year-round recreation in area. lyear-round protected moorage & a newly built solar & generator. 3,500 home. Pan-Abode expansion of the Prince Rupert Container 2.992 fe main house. Many outbuildings. Serviced with underground power, telephone, west coast contemporary home. Only a few cabin, summer kitchen, 2 additional cabins, Port, projects on Ridley Island & Watson Fully serviced. Picturesque views. $519,000 water and sewer. $199,000 bathhouse, shed & Quonset. $2,100,000 goats. Grazing Licence for 40 cow / calf pairs. for a cabin or year cound living. Great boating. & Protection Island. 30 ft licensed dock with minutes boat ride from government wharf Igeneral store & Desolation Sound. $749,000 Island, double-tracking the CNR. $3,950.000 RICHARD OSBORNE 604-664-7633 RICHARD OSBORNE 604-664-7633 SAM HODSON 604-694-7623 MATT CAMERON 250-200-1199 JAMIE ZROBACK 1404-483-1605 Personal Real Estate Corporation richalandquest.com Personal Real Estate Corporation richalandquest.com Personal Real Estate Corporation samalandquest.com mattelandquest.com JASON ZROBACK 1404-414-5577 OCEANFRONT HIDEAWAY RARE PRIVATE ISLAND WITH LOG CABIN 75 ACRES OF FLAT FARMLAND ALONG PICTURESQUE HORSE PROPERTY ""TAKE IT EASY"" AT EAGLE BAY ON STUART LAKE - FORT ST. JAMES, BC DE COURCY ISLAND, BC THE NORTH THOMPSON RIVER PABLO CREEK - WILLIAMS LAKE, BC Three separate 1.5 acre southwest facing low Rare & affordable opportunity to purchase Clearwater, BC. Scenic farm property along There are options on this south Shuswap 2,088 ft 3 bdm, 3 bath rancher on 186 bank oceanfront lots with approx. 669 t of your very own 100% private island on scenic the banks of the North Thompson River. 75 property; outstanding lake view estate, waterfront. Architecturally designed, custom Stuart Lake. This 20 acre island offers a Jacres with a 4 bdrm bungalow, direct road group purchase and subdivision opportunity. pond, surrounded by fruit trees, wildlife buit 1,610 home with studio on centre lot. cozy 480 f log cabin with woodstove. The trontage & 56 acres of flat fertile hay land. Privacy assured or flexibility to hand pick your shorelines are gentle & shalow, perfect for Great option for existing farmers or someone neighbours. Well-appointed for year-round mooring a boat. The beaches provide plenty of looking for a change of pace. Averaging Joffer fantastic views. Water rights in 2 building site with services, de-activated air living. NEW PRICE $769,000 acres just 15 mins from Williams Lake. Large Access to a nice beach for recreation & commanding views. Large horse barn, and boat moorage. Several terraces numerous corrals, fenced & crossed fenced. southem exposure. NEW PRICE $175.000 250 - 300 bales with no imigation. $50,000 place. NEW PRICE S50,000 strip and more. Must see property! $777,000 JOHN ARMSTRONG 250-307-2100 FAWN GUNDERSON 250-982-2314 JAMIE ZROBACK 1-604-483-1605 CHASE WESTERSUND 778-927-634 COLE WESTERSUND 604-360-4793 COLE WESTERSUND 604-360-0793 johnalandquest.com LandQuest"" Realty Corp Cariboo Personal Real Estate Corporation JASON ZROBACK 1404-414-5S77 CHASE WESTERSUND 778-927-4634 fawnltandquest.com ""The Source"" for Oceanfront, Lakefront, Islands, Ranches, Resorts & Land in BC f Toll Free 1-866-558-LAND (5263)",[]
48,nationalpost,http://local.nationalpost.com/toronto-ca-on/rsm-canada-limited-647-726-0496/2020-07-08-11199277-in-the-matter-of-the-bankruptcy-of-newgen-restaurant-services-inc-notice-to-creditors-of-first-meeting-is-hereby-given-that-the-bankruptcy-of-newgen-restaurant-services-inc-dot-formerly-operating-as-smith-bros-steakhouse-tavern-at-880-n,"WEDNESDAY, JULY 8, 2020 Ad",[],2020-07-08,"IN THE MATTER OF THE BANKRUPTCY OF NEWGEN RESTAURANT SERVICES INC. NOTICE TO CREDITORS OF FIRST MEETING is hereby given that the bankruptcy of Newgen Restaurant Services Inc., formerly operating as Smith Bros. Steakhouse Tavern at 880 Notice Warden Avenue, Toronto and as Tucker's Marketplace at 15 Carlson Court, Toronto and other locations in Ontario, occurred on the 26th day of June, 2020, and that the first meeting of creditors will be held on the 15th day of July, 2020 at 10:00 a.m. via teleconference. Please contact the Trustee to obtain the teleconference details. To be entitled to vote at the meeting, a creditor must file with the Trustee, before the meeting, a proof of claim and, where necessary, a proxy. Dated at Toronto in the Province of Ontario, this 8th day of July, 2020. RSM CANADA LIMITED Licensed Insolvency Trustee 11 King St. W., Suite 700 Toronto, Ontario, 47 RSM Tel. (647) 730-3728 Fax (416) 480-2646 Visit rsmcanada.com/aboutus for more information regarding RSM Canada Limited. IN THE MATTER OF THE BANKRUPTCY OF NEWGEN RESTAURANT SERVICES INC. NOTICE TO CREDITORS OF FIRST MEETING is hereby given that the bankruptcy of Newgen Restaurant Services Inc., formerly operating as Smith Bros. Steakhouse Tavern at 880 Notice Warden Avenue, Toronto and as Tucker's Marketplace at 15 Carlson Court, Toronto and other locations in Ontario, occurred on the 26th day of June, 2020, and that the first meeting of creditors will be held on the 15th day of July, 2020 at 10:00 a.m. via teleconference. Please contact the Trustee to obtain the teleconference details. To be entitled to vote at the meeting, a creditor must file with the Trustee, before the meeting, a proof of claim and, where necessary, a proxy. Dated at Toronto in the Province of Ontario, this 8th day of July, 2020. RSM CANADA LIMITED Licensed Insolvency Trustee 11 King St. W., Suite 700 Toronto, Ontario, 47 RSM Tel. (647) 730-3728 Fax (416) 480-2646 Visit rsmcanada.com/aboutus for more information regarding RSM Canada Limited.",[]
49,nationalpost,http://local.nationalpost.com/toronto-ca-on/harvey-kalles-robert-greenberg-team-416-441-2888/2020-07-04-11196426-robert-greenberg-sales-representative-416-dot-543-dot-1507-info-at-robertgreenberg-dot-com-www-dot-robertgreenberg-dot-com-in-boret-creeenteah-roi-i-and-hili-byappontmentony-the-residences-of-croft-and-hill-pappontment-ony-eappontment-o,"SATURDAY, JULY 4, 2020 Ad",[],2020-07-04,"ROBERT GREENBERG SALES REPRESENTATIVE 416.543.1507 INFO@ROBERTGREENBERG.COM www.ROBERTGREENBERG.COM in BORET CREEENTEAH (ROI I&HILI BYAPPONTMENTONY THE RESIDENCES OF CROFT & HILL PAPPONTMENT ONY EAPPONTMENT ONT 8 FRIVICK CRT BY APPONTMENT ONLY 95 OLD COLONY RD 151 YONGE BLVD tSANG18 APRI RO -EA POILARS ROERT GREDEG- -ZA POILARA RONERT OCIE- KPOR APONTEN OY 32 WALDER AVE APPOINTMENT ONY 22 LEADER LANE I539 70 TEMPERANCE ST AS104 155 YORKVILLE AVE F3112 APR I r - REZA POLARAROBERr SAEDNG- STUDOAIAT APP IS F -ANDREKUTANROERT GREENA APRO N -ROT GIS AANDREKUTAN- -ANOREKuANSo E SOLD FORLEASE FORLTAS FOR LEASE 11 PARKWOOD AVE 235 OUNVEGAN RO MONT SI d LOTS EDS AOS OBE ORENERANDE 351 DELORAINE AVE OMONT SISI LOT 3-1 BOS LAG 107 DUNVEGAN RD RORESENT SEu AND ER SO ON ANE -ROBERT OREEMRGA NDREKUTAN- LOMER LVEL IEDS1 -REA PORLARROOT SENE SCHED T SO SOLD SOLD 182 GLENGROVE AVE W RECEVED MTPLEOFERS SOI ON JUNER ANDETANS kT REDN- 473 GLENCAIRN AVE 276 STRATHALLAN WOO0 200 BLOOR ST W #1905 RECO MATPEOFES RECEMED MPLEOFFERS SOLDON JUNEn -ANDRUTAN SROBDT SRE- SOLD ON JUNE sasON JUNE L NUMBER ONE SALES TEAM AT HARVEY KALLES SINCE 2004* AS AN ESSENTIAL SERVICE. WE RECOONIZE THE NEED FOR BUYERS AND/OR SELLERS TO TRANSACT DURING THESE UNPRECEDENTED TIMES. REST ASSURED. OUR INDUSTRY HAS SET UP STRICT COVID-19 SAFETY PROTOCOLS. PUBLIC HEALTH AND SAFETY ARE PARAMOUNT ANDRE KUTYAN SAL NTAE REZA IPCHILAR OUR BUSINESS CONTINUES TO OPERATE, 416.451.2642 416.770.1010 HOWEVER REMOTELY ANDRESHARVEYKALLES.COM www.ANDREKUTYAN.COM REZASHARVEYKALLES.COM www.JREZA.CA 2145 AVENUE ROAD. TORONTO ON M5M 4B2 416.441.2888 HARVEY KALLES EACESTATE LT AROERAGE SAD ON TEAM CH oTDOLLAR VEOFSUSTNOS sOLDANO TO UNITS sOLD 35 YEARS ROBERT GREENBERG SALES REPRESENTATIVE 416.543.1507 INFO@ROBERTGREENBERG.COM www.ROBERTGREENBERG.COM in BORET CREEENTEAH (ROI I&HILI BYAPPONTMENTONY THE RESIDENCES OF CROFT & HILL PAPPONTMENT ONY EAPPONTMENT ONT 8 FRIVICK CRT BY APPONTMENT ONLY 95 OLD COLONY RD 151 YONGE BLVD tSANG18 APRI RO -EA POILARS ROERT GREDEG- -ZA POILARA RONERT OCIE- KPOR APONTEN OY 32 WALDER AVE APPOINTMENT ONY 22 LEADER LANE I539 70 TEMPERANCE ST AS104 155 YORKVILLE AVE F3112 APR I r - REZA POLARAROBERr SAEDNG- STUDOAIAT APP IS F -ANDREKUTANROERT GREENA APRO N -ROT GIS AANDREKUTAN- -ANOREKuANSo E SOLD FORLEASE FORLTAS FOR LEASE 11 PARKWOOD AVE 235 OUNVEGAN RO MONT SI d LOTS EDS AOS OBE ORENERANDE 351 DELORAINE AVE OMONT SISI LOT 3-1 BOS LAG 107 DUNVEGAN RD RORESENT SEu AND ER SO ON ANE -ROBERT OREEMRGA NDREKUTAN- LOMER LVEL IEDS1 -REA PORLARROOT SENE SCHED T SO SOLD SOLD 182 GLENGROVE AVE W RECEVED MTPLEOFERS SOI ON JUNER ANDETANS kT REDN- 473 GLENCAIRN AVE 276 STRATHALLAN WOO0 200 BLOOR ST W #1905 RECO MATPEOFES RECEMED MPLEOFFERS SOLDON JUNEn -ANDRUTAN SROBDT SRE- SOLD ON JUNE sasON JUNE L NUMBER ONE SALES TEAM AT HARVEY KALLES SINCE 2004* AS AN ESSENTIAL SERVICE. WE RECOONIZE THE NEED FOR BUYERS AND/OR SELLERS TO TRANSACT DURING THESE UNPRECEDENTED TIMES. REST ASSURED. OUR INDUSTRY HAS SET UP STRICT COVID-19 SAFETY PROTOCOLS. PUBLIC HEALTH AND SAFETY ARE PARAMOUNT ANDRE KUTYAN SAL NTAE REZA IPCHILAR OUR BUSINESS CONTINUES TO OPERATE, 416.451.2642 416.770.1010 HOWEVER REMOTELY ANDRESHARVEYKALLES.COM www.ANDREKUTYAN.COM REZASHARVEYKALLES.COM www.JREZA.CA 2145 AVENUE ROAD. TORONTO ON M5M 4B2 416.441.2888 HARVEY KALLES EACESTATE LT AROERAGE SAD ON TEAM CH oTDOLLAR VEOFSUSTNOS sOLDANO TO UNITS sOLD 35 YEARS",[]
50,nationalpost,http://local.nationalpost.com/toronto-ca-on/soho-hotel-and-residences-toronto-416-599-8800/2020-07-04-11196427-the-soho-hotel-weekend-special-225-dollars-slash-night-third-night-free-dot-sohohotel-318-wellington-street-west-toronto-the-well-being-of-our-guests-and-associates-is-of-paramount-importance-please-stay-safe-and-be-well-the-soho-hotel-,SoHo Hotel & Residences Toronto,[],2020-07-04,"THE SOHO HOTEL Weekend special $225/night. Third night free."" SOHOHOTEL. 318 WELLINGTON STREET WEST, TORONTO THE WELL BEING OF OUR GUESTS AND ASSOCIATES IS OF PARAMOUNT IMPORTANCE. PLEASE STAY SAFE AND BE WELL. THE SOHO HOTEL Weekend special $225/night. Third night free."" SOHOHOTEL. 318 WELLINGTON STREET WEST, TORONTO THE WELL BEING OF OUR GUESTS AND ASSOCIATES IS OF PARAMOUNT IMPORTANCE. PLEASE STAY SAFE AND BE WELL.",[]
51,nationalpost,http://local.nationalpost.com/toronto-ca-on/forest-hill-real-estate-inc-jeffrey-wagman-416-488-2875/2020-07-04-11196428-priced-to-sell-now-103-dunloe-road-just-listed-112-warren-road-9700-dollars-000-4890-dollars-000-beautiful-and-elegant-forest-hill-magnificent-forest-hill-home-on-whats-considered-by-residence-66-foot-frontage-renovated-with-style-many-,Forest Hill Real Estate Inc,[],2020-07-04,"PRICED TO SELL NOW!! 103 DUNLOE ROAD JUST LISTED! 112 WARREN ROAD $9,700,000 $4,890,000 Beautiful and elegant Forest Hill Magnificent Forest Hill Home on what's considered by residence. 66 foot frontage, renovated with style. many to be the most prestigious street in the area. 75 x Soaring ceilings, lots of natural light. 4 plus bedrooms, 173 foot west facing lot with stunning infinity pool and 3 baths on second level, fabulous landscaping and spa. 3-storey, 6 bedrooms, fabulous kitchen with floor gated driveway entrance. to ceiling glass doors. Walk to all the top schools!! FIRST AD. 64 OLD FOREST HILL ROAD $9,500,000 FIRST AD. 56 GLENFOREST ROAD $2,449,000 111 Absolutely Stunning Grand Tudor With Incredible Street Presence. Fabulous Family Home On Great Street In Prime Neighbourhood. Great Meticulously Renovated From Top To Bottom And Stripped To The Main Floor Kitchen / Family Room With Walkout To Large Deck. Wonderful Bare Walls. Only The Finest Materials Sourced! Large Circular Driveway Master Suite With Vaulted Ceilings, Walk-In Closet And Massive 6 Piece Adds To The Elegance Here. European Inspired Outdoor Living With Ensuite. Basement Made For Kids! Large Playroom With High Ceilings And Outdoor Cooking Area. Elegant Master Suite With Gorgeous Ensuite Lots Of Shelving. Large Turf Backyard For Easy Maintenance, And Plenty And His And Hers Walk-In Closets. Nothing Was Overlooked! Of Playroom And Entertaining Area! Move Right In! Many Upgrades! Forest Hil JEFFREY WAGMAN 416-785-1500 Broker of Record REAL ESTATE INC. BROKERAGE 416-817-7100 PRICED TO SELL NOW!! 103 DUNLOE ROAD JUST LISTED! 112 WARREN ROAD $9,700,000 $4,890,000 Beautiful and elegant Forest Hill Magnificent Forest Hill Home on what's considered by residence. 66 foot frontage, renovated with style. many to be the most prestigious street in the area. 75 x Soaring ceilings, lots of natural light. 4 plus bedrooms, 173 foot west facing lot with stunning infinity pool and 3 baths on second level, fabulous landscaping and spa. 3-storey, 6 bedrooms, fabulous kitchen with floor gated driveway entrance. to ceiling glass doors. Walk to all the top schools!! FIRST AD. 64 OLD FOREST HILL ROAD $9,500,000 FIRST AD. 56 GLENFOREST ROAD $2,449,000 111 Absolutely Stunning Grand Tudor With Incredible Street Presence. Fabulous Family Home On Great Street In Prime Neighbourhood. Great Meticulously Renovated From Top To Bottom And Stripped To The Main Floor Kitchen / Family Room With Walkout To Large Deck. Wonderful Bare Walls. Only The Finest Materials Sourced! Large Circular Driveway Master Suite With Vaulted Ceilings, Walk-In Closet And Massive 6 Piece Adds To The Elegance Here. European Inspired Outdoor Living With Ensuite. Basement Made For Kids! Large Playroom With High Ceilings And Outdoor Cooking Area. Elegant Master Suite With Gorgeous Ensuite Lots Of Shelving. Large Turf Backyard For Easy Maintenance, And Plenty And His And Hers Walk-In Closets. Nothing Was Overlooked! Of Playroom And Entertaining Area! Move Right In! Many Upgrades! Forest Hil JEFFREY WAGMAN 416-785-1500 Broker of Record REAL ESTATE INC. BROKERAGE 416-817-7100",[]
52,nationalpost,http://local.nationalpost.com/toronto-ca-on/harvey-kalles-real-estate-sherkin-langer-and-castle-416-441-2888/2020-07-04-11196429-ferne-sherkin-langer-nina-castle-sherkin-langer-castle-broker-broker-416-dot-543-dot-4833-castle-dot-n-at-rogers-dot-com-416-dot-844-dot-5704-fslanger-at-rogers-dot-com-lets-talk-real-estate-lets-talk-real-estate-k-harvey-kalles-245-ave,"SATURDAY, JULY 4, 2020 Ad",[],2020-07-04,"ferne sherkin-langer nina castle sherkin-langer castle BROKER BROKER 416.543.4833 castle.n@rogers.com 416.844.5704 fslanger@rogers.com let's talk real estate. let's talk real estate. K HARVEY KALLES 245 Avenue Road Toronto, ON MEM 482 416.4412888 www.sherkinlangerandcastlecom REAL ESTATE LTD. BROKERAGE THE NEST NEW PRICE SOLD! NEW LISTING 201 Burbank Drive 10 Delisle Ave Suite 403 835 St Clair Ave West #315 A take your breath away R-A-V-I-N-E property in sought åfter Bayview Village. Outstanding privacy and tremendous views. Premier cul de sac. Lovely and spacious updated bungalow with outstanding sightlines from every room. Custom modern kitchen, Open concept Living/ Dining Room with large picture window. Lower level walk-out ravine two bedrooms, rec room, laundry and storage. Huge two car attached garage. Experience country in the city on this 60 by 126 ft lot. Revel in the expansive tableland. Move-in, renovate or build; the choice is yours. $2,398,000. Yonge and St Clair- The best Toronto has to offer Enjoy Contemporary Luury in This Boutique Building in The Heart of 1555 Finch Ave East 3008- Skymark IL One of Tidels finest. North West in this classy building. A5 minute walk down the Wychwood. Spacious and Well Designed. 1260 sq 2+1 Bedroom 2Comer sub penthouse sute with imposing views. This is your bungalow tree lined street to some of the best restos and Open Concept Living Space. Gorgeous Knchen with SS Applances and galore, hardwood foors, separate formal lving and dning rooms, eat- shops, public transit and great green spaces for Extended Quartz island. Many Upgrades, Playroom/ Ofice /Den. Largein kitchen plus a large family room. Great Location Close To Shopping. walking. This 730 sq foot, One bedroom, hasSunny South Facing Balcony With A Buib-in Gas Line for a BBQ. Buiding |Supemarkets, Restaurants, Highways, Pubic Transit, Schools And Seneca a separate den and has been nicely updated. Parking. Concierge, Pet Spa, And Much More. 1 Parking Space and a Parking and a Locker are included. Bath Condo, King Siaed MBR Suite, Custom WI Closet and Ensuite Bathin the sky Outstandingl 2 huge bedrooms, 3 bathrooms, coset space Amenities Include: Rooftop Deck, Party Room, Guest Suite, Vistor College. Condo Fees include Hydro, Water, Cable, Aed Great Amenites. Gatehouse Security, Indoor & Oundoor Pools, Exercise Room, Squash and Tennis Courts. S799,000. Locker. Simply Perfection. $1,149,000. ferne sherkin-langer nina castle sherkin-langer castle BROKER BROKER 416.543.4833 castle.n@rogers.com 416.844.5704 fslanger@rogers.com let's talk real estate. let's talk real estate. K HARVEY KALLES 245 Avenue Road Toronto, ON MEM 482 416.4412888 www.sherkinlangerandcastlecom REAL ESTATE LTD. BROKERAGE THE NEST NEW PRICE SOLD! NEW LISTING 201 Burbank Drive 10 Delisle Ave Suite 403 835 St Clair Ave West #315 A take your breath away R-A-V-I-N-E property in sought åfter Bayview Village. Outstanding privacy and tremendous views. Premier cul de sac. Lovely and spacious updated bungalow with outstanding sightlines from every room. Custom modern kitchen, Open concept Living/ Dining Room with large picture window. Lower level walk-out ravine two bedrooms, rec room, laundry and storage. Huge two car attached garage. Experience country in the city on this 60 by 126 ft lot. Revel in the expansive tableland. Move-in, renovate or build; the choice is yours. $2,398,000. Yonge and St Clair- The best Toronto has to offer Enjoy Contemporary Luury in This Boutique Building in The Heart of 1555 Finch Ave East 3008- Skymark IL One of Tidels finest. North West in this classy building. A5 minute walk down the Wychwood. Spacious and Well Designed. 1260 sq 2+1 Bedroom 2Comer sub penthouse sute with imposing views. This is your bungalow tree lined street to some of the best restos and Open Concept Living Space. Gorgeous Knchen with SS Applances and galore, hardwood foors, separate formal lving and dning rooms, eat- shops, public transit and great green spaces for Extended Quartz island. Many Upgrades, Playroom/ Ofice /Den. Largein kitchen plus a large family room. Great Location Close To Shopping. walking. This 730 sq foot, One bedroom, hasSunny South Facing Balcony With A Buib-in Gas Line for a BBQ. Buiding |Supemarkets, Restaurants, Highways, Pubic Transit, Schools And Seneca a separate den and has been nicely updated. Parking. Concierge, Pet Spa, And Much More. 1 Parking Space and a Parking and a Locker are included. Bath Condo, King Siaed MBR Suite, Custom WI Closet and Ensuite Bathin the sky Outstandingl 2 huge bedrooms, 3 bathrooms, coset space Amenities Include: Rooftop Deck, Party Room, Guest Suite, Vistor College. Condo Fees include Hydro, Water, Cable, Aed Great Amenites. Gatehouse Security, Indoor & Oundoor Pools, Exercise Room, Squash and Tennis Courts. S799,000. Locker. Simply Perfection. $1,149,000.",[]
