,outlet,url,title,authors,publish_date,text,keywords
36,nationalpost,http://local.nationalpost.com/toronto-on/christies-chestnut-park-real-estate-the-rennie-team-416-925-9191,Christie's Chestnut Park Real Estate,[],,"About Chestnut Park’s #1 Team for 15 Years! – The Rennie Team brings over 80 years of combined experience in real estate, marketing and in-depth knowledge of Toronto’s Central Core. They say good things come in threes. When you work with us you’ll witness a unique blend of attributes that set us apart. Janice, Julie, and Katie each bring their distinctive personality and professional contribution to the team by working individually and together to set a new standard of service in our industry. Our passion for real estate and the Toronto Community is what makes us stand out from the competition. We are known for our in-depth understanding of the ever-changing marketplace and are committed to providing our clients with a wealth of knowledge to help them make the right move for a smart investment. As a team we are aware that the industry and market are changing – and so are we! By combining cutting-edge technology and just the right mix of traditional and modern marketing, we can guarantee our client partnerships unparalleled results.",[]
37,nationalpost,http://local.nationalpost.com/toronto-on/harvey-kalles-real-estate-sherkin-langer-and-castle-416-441-2888,Harvey Kalles Real Estate,[],,About Sherkin-Langer and Castle was established in 2005 in response to a recognized need for luxury real estate service with a specialized focus on the Toronto Real Estate Market and the Greater Toronto Area.,[]
38,nationalpost,http://local.nationalpost.com/toronto-on/christies-chestnut-park-real-estate-limited-416-925-9191,Christie's Chestnut Park Real Estate Limited,[],,"About View the latest in Toronto Real Estate and Toronto luxury homes. We service areas including Toronto, Muskoka, Collingwood and Prince Edward County.",[]
39,nationalpost,http://local.nationalpost.com/toronto-on/harvey-kalles-robert-greenberg-team-416-441-2888,Robert Greenberg Team,[],,"About Robert has been serving the community with independent brokerage Harvey Kalles Real Estate, one of the premier real estate agencies in Toronto, for the past 32 years—and been the top selling Toronto real estate agent for 28 of them. Robert and his team of Toronto realtors specialize in luxury properties in Forest Hill, Lawrence Park, Lytton Park, and Leaside, as well as neighbourhoods along Avenue Road, Bayview Avenue, and York Mills Road.",[]
40,nationalpost,http://local.nationalpost.com/toronto-on/house-of-anansi-press-inc-416-363-4343,House of Anansi Press Inc,[],,"About House of Anansi Press is a Canadian publishing company, founded in 1967 by writers Dennis Lee and Dave Godfrey.",[]
41,nationalpost,http://local.nationalpost.com/toronto-ca-on/harvey-kalles-robert-greenberg-team-416-441-2888/2020-07-11-11204891-robert-greenberg-sales-representative-416-dot-543-dot-1507-info-at-robertgreenberg-dot-com-www-dot-robertgreenberg-dot-com-in-boet-creeen-teah-roi-i-and-hili-byappontmentony-the-residences-of-croft-and-hill-pappontment-only-comng-soon-b,"SATURDAY, JULY 11, 2020 Ad",[],2020-07-11,"ROBERT GREENBERG SALES REPRESENTATIVE 416.543.1507 INFO@ROBERTGREENBERG.COM www.ROBERTGREENBERG.cOM in BOET CREEEN TEAH (ROI I&HILI BYAPPONTMENTONY THE RESIDENCES OF CROFT & HILL PAPPONTMENT ONLY COMNG SOON BYAPPOINTMENT ONLY 95 OLD COLONY RD 259 GLENCAIRN AVE S NE APP A -MORE N RORT SREERS- 151 YONGE BLVD tSANG18 APR I APO A -REDA POLARLROoT RIERO- POR APPONTMENT ONY 32 WALDER AVE AONTMNT ONY 22 LEADER LANE IS39 YAPONTMNTONY BYAPPONTVENT 95 BAYCREST AVE COMNG SON SI 70 TEMPERANCE ST S104 STUDOS1 APPRO -ANOREKUAN SROERT GREEE -RRT GREINERSA ANDENAN -NDE KUTAN ROBERT GREEE- -EZA POLARAROI ENE FORLEAM 11 PARKWOOD AVE LOMER LEVEIOIN BYAPPONTMENT ONLY FORLEAE 155 YORKVILLE AVE #3112 1 STUDO I 351 DELORAINE AVE 235 DUNVEGAN RD ORT OREENEANOETAN 10BET REENBENG ANOREUAN SEZA POHLARAORT OEN- SOLED SOED SOEDSOLD 107 DUNVEGAN RD REPRSSENED THESLLR ANG R SOLD IN JUNEI 182 GLENGROVE AVE W RD MTPLEOERS SOLDON JUNEI ANCE 473 GLENCAIRN AVE 276 STRATHALLAN WOOD REOVE MREDES saJON JUNE IS. lerem SOL ON JUNE otor ENESANOREKN -ANORE KAN SOr s. NUMBER ONE SALES TEAM AT HARVEY KALLES SINCE 2004* AS AN ESSENTIAL SERVICE WE RECOONIZE THE NEED FOR BUYERS AND/OR SELLERS TO TRANSACT DURING THESE UNPRECEDENTED TIMES. REST ASSURED. OUR INDUSTRY HAS SET UP STRICT COVID-19 SAFETY PROTOCOLS. PUBLIC HEALTH AND SAFETY ARE PARAMOUNT ANDRE KUTYAN SAL NTAE REZA IPCHILAR OUR BUSINESS CONTINUES TO OPERATE, 416.451.2642 416.770.1010 HOWEVER REMOTELY ANDRESHARVEYKALLES.COM www.ANDREKUTYAN.COM REZASHARVEYKALLES.COM www.JREZA.CA 2145 AVENUE ROAD. TORONTO ON M5M 4B2 416.441.2888 HARVEY KALLES EACESTATE LT AROERAGE SAD ON TEAM CH oTDOLLAR VEOFSUSTNOS sOLDANO TO UNITS sOLD 35 YEARS ROBERT GREENBERG SALES REPRESENTATIVE 416.543.1507 INFO@ROBERTGREENBERG.COM www.ROBERTGREENBERG.cOM in BOET CREEEN TEAH (ROI I&HILI BYAPPONTMENTONY THE RESIDENCES OF CROFT & HILL PAPPONTMENT ONLY COMNG SOON BYAPPOINTMENT ONLY 95 OLD COLONY RD 259 GLENCAIRN AVE S NE APP A -MORE N RORT SREERS- 151 YONGE BLVD tSANG18 APR I APO A -REDA POLARLROoT RIERO- POR APPONTMENT ONY 32 WALDER AVE AONTMNT ONY 22 LEADER LANE IS39 YAPONTMNTONY BYAPPONTVENT 95 BAYCREST AVE COMNG SON SI 70 TEMPERANCE ST S104 STUDOS1 APPRO -ANOREKUAN SROERT GREEE -RRT GREINERSA ANDENAN -NDE KUTAN ROBERT GREEE- -EZA POLARAROI ENE FORLEAM 11 PARKWOOD AVE LOMER LEVEIOIN BYAPPONTMENT ONLY FORLEAE 155 YORKVILLE AVE #3112 1 STUDO I 351 DELORAINE AVE 235 DUNVEGAN RD ORT OREENEANOETAN 10BET REENBENG ANOREUAN SEZA POHLARAORT OEN- SOLED SOED SOEDSOLD 107 DUNVEGAN RD REPRSSENED THESLLR ANG R SOLD IN JUNEI 182 GLENGROVE AVE W RD MTPLEOERS SOLDON JUNEI ANCE 473 GLENCAIRN AVE 276 STRATHALLAN WOOD REOVE MREDES saJON JUNE IS. lerem SOL ON JUNE otor ENESANOREKN -ANORE KAN SOr s. NUMBER ONE SALES TEAM AT HARVEY KALLES SINCE 2004* AS AN ESSENTIAL SERVICE WE RECOONIZE THE NEED FOR BUYERS AND/OR SELLERS TO TRANSACT DURING THESE UNPRECEDENTED TIMES. REST ASSURED. OUR INDUSTRY HAS SET UP STRICT COVID-19 SAFETY PROTOCOLS. PUBLIC HEALTH AND SAFETY ARE PARAMOUNT ANDRE KUTYAN SAL NTAE REZA IPCHILAR OUR BUSINESS CONTINUES TO OPERATE, 416.451.2642 416.770.1010 HOWEVER REMOTELY ANDRESHARVEYKALLES.COM www.ANDREKUTYAN.COM REZASHARVEYKALLES.COM www.JREZA.CA 2145 AVENUE ROAD. TORONTO ON M5M 4B2 416.441.2888 HARVEY KALLES EACESTATE LT AROERAGE SAD ON TEAM CH oTDOLLAR VEOFSUSTNOS sOLDANO TO UNITS sOLD 35 YEARS",[]
42,nationalpost,http://local.nationalpost.com/toronto-ca-on/harvey-kalles-real-estate-sherkin-langer-and-castle-416-441-2888/2020-07-11-11204892-ferne-sherkin-langer-nina-castle-sherkin-langer-castle-broker-broker-416-dot-543-dot-4833-castle-dot-n-at-rogers-dot-com-416-dot-844-dot-5704-fslanger-at-rogers-dot-com-lets-talk-real-estate-lets-talk-real-estate-k-harvey-kalles-245-ave,"SATURDAY, JULY 11, 2020 Ad",[],2020-07-11,"ferne sherkin-langer nina castle sherkin-langer castle BROKER BROKER 416.543.4833 castle.n@rogers.com 416.844.5704 fslanger@rogers.com let's talk real estate. let's talk real estate. K HARVEY KALLES 245 Avenue Road Toronto, ON MEM 482 416.4412888 www.sherkinlangerandcastle.com REAL ESTATE LTD. BROKERAGE THE NEST SOLD! NEW PRICE SOLD! NEW LISTING 201 Burbank Drive 10 Delisle Ave Suite 403 835 St Clair Ave West #315 A take your breath away R-A-V-I-N-E property in sought åfter Bayview Village. Outstanding privacy tremendous views. Premier cul de sac. Lovely and spacious updated bungalow with outstanding sightlines from every room. Custom modern kitchen, Open concept Living/ Dining Room with large picture window. Lower level walk-out ravine two bedrooms, rec room, laundry and storage. Huge two car attached garage. Experience country in the city on this 60 by 126 ft lot. Revel in the expansive tableland. Move-in, renovate or build; the choice is yours. $2,398,000. Yonge and St Clair- The best Toronto has to offer Enjoy Contemporary Luury in This Boutique Building in The Heart of 1555 Finch Ave East 3008- Skymark IL One of Tidels finest. North West in this classy building. A5 minute walk down the Wychwood. Spacious and Well Designed. 1260 sq 2+1 Bedroom 2Comer sub penthouse sute with imposing views. This is your bungalow Bath Condo, King Siaed MBR Suite, Custom WI Closet and Ensuite Bathin the sky Outstandingl 2 huge bedrooms, 3 bathrooms, coset space tree lined street to some of the best restos and Open Concept Living Space. Gorgeous Knchen with SS Applances and galore, hardwood foors, separate formal lving and dning rooms, eat- shops, public transit and great green spaces for Extended Quartz island. Many Upgrades, Playroom/ Ofice /Den. Largein kitchen plus a large family room. Great Location Close To Shopping. walking. This 730 sq foot, One bedroom, hasSunny South Facing Balcony With A Buib-in Gas Line for a BBQ. Buiding |Supemarkets, Restaurants, Highways, Pubic Transit, Schools And Seneca Amenities Include: Rooftop Deck, Party Room, Guest Suite, Vistor College. Condo Fees include Hydro, Water, Cable, Aed Great Amenites. a separate den and has been nicely updated. Parking. Concierge, Pet Spa, And Much More. 1 Parking Space and a Gatehouse Security, Indoor & Oundoor Pools, Exercise Room, Squash and Tennis Courts. S799,000. Parking and a Locker are included. $725,000. Locker. Simply Perfection. $1,149,000. NEW LISTING ferne sherkin-langer nina castle sherkin-langer castle BROKER BROKER 416.543.4833 castle.n@rogers.com 416.844.5704 fslanger@rogers.com let's talk real estate. let's talk real estate. K HARVEY KALLES 245 Avenue Road Toronto, ON MEM 482 416.4412888 www.sherkinlangerandcastle.com REAL ESTATE LTD. BROKERAGE THE NEST SOLD! NEW PRICE SOLD! NEW LISTING 201 Burbank Drive 10 Delisle Ave Suite 403 835 St Clair Ave West #315 A take your breath away R-A-V-I-N-E property in sought åfter Bayview Village. Outstanding privacy tremendous views. Premier cul de sac. Lovely and spacious updated bungalow with outstanding sightlines from every room. Custom modern kitchen, Open concept Living/ Dining Room with large picture window. Lower level walk-out ravine two bedrooms, rec room, laundry and storage. Huge two car attached garage. Experience country in the city on this 60 by 126 ft lot. Revel in the expansive tableland. Move-in, renovate or build; the choice is yours. $2,398,000. Yonge and St Clair- The best Toronto has to offer Enjoy Contemporary Luury in This Boutique Building in The Heart of 1555 Finch Ave East 3008- Skymark IL One of Tidels finest. North West in this classy building. A5 minute walk down the Wychwood. Spacious and Well Designed. 1260 sq 2+1 Bedroom 2Comer sub penthouse sute with imposing views. This is your bungalow Bath Condo, King Siaed MBR Suite, Custom WI Closet and Ensuite Bathin the sky Outstandingl 2 huge bedrooms, 3 bathrooms, coset space tree lined street to some of the best restos and Open Concept Living Space. Gorgeous Knchen with SS Applances and galore, hardwood foors, separate formal lving and dning rooms, eat- shops, public transit and great green spaces for Extended Quartz island. Many Upgrades, Playroom/ Ofice /Den. Largein kitchen plus a large family room. Great Location Close To Shopping. walking. This 730 sq foot, One bedroom, hasSunny South Facing Balcony With A Buib-in Gas Line for a BBQ. Buiding |Supemarkets, Restaurants, Highways, Pubic Transit, Schools And Seneca Amenities Include: Rooftop Deck, Party Room, Guest Suite, Vistor College. Condo Fees include Hydro, Water, Cable, Aed Great Amenites. a separate den and has been nicely updated. Parking. Concierge, Pet Spa, And Much More. 1 Parking Space and a Gatehouse Security, Indoor & Oundoor Pools, Exercise Room, Squash and Tennis Courts. S799,000. Parking and a Locker are included. $725,000. Locker. Simply Perfection. $1,149,000. NEW LISTING",[]
43,nationalpost,http://local.nationalpost.com/toronto-ca-on/soho-hotel-and-residences-toronto-416-599-8800/2020-07-11-11204893-the-soho-hotel-weekend-special-225-dollars-slash-night-third-night-free-dot-sohohotel-318-wellington-street-west-toronto-the-well-being-of-our-guests-and-associates-is-of-paramount-importance-please-stay-safe-and-be-well-the-soho-hotel-,SoHo Hotel & Residences Toronto,[],2020-07-11,"THE SOHO HOTEL Weekend special $225/night. Third night free."" SOHOHOTEL. 318 WELLINGTON STREET WEST, TORONTO THE WELL BEING OF OUR GUESTS AND ASSOCIATES IS OF PARAMOUNT IMPORTANCE. PLEASE STAY SAFE AND BE WELL. THE SOHO HOTEL Weekend special $225/night. Third night free."" SOHOHOTEL. 318 WELLINGTON STREET WEST, TORONTO THE WELL BEING OF OUR GUESTS AND ASSOCIATES IS OF PARAMOUNT IMPORTANCE. PLEASE STAY SAFE AND BE WELL.",[]
44,nationalpost,http://local.nationalpost.com/ottawa-ca-on/mtis-national-council-613-232-3216/2020-07-11-11204922-advertisement-on-behalf-of-the-metis-national-council-minister-and-vice-president-david-chartrand-is-honoured-to-announce-the-establishment-of-the-metis-veterans-legacy-program-i-want-to-thank-all-those-who-have-come-together-from-acros,"SATURDAY, JULY 11, 2020 Ad",[],2020-07-11,"ADVERTISEMENT On behalf of the Métis National Council, Minister and Vice-President David Chartrand is honoured to announce the establishment of the MÉTIS VETERANS LEGACY PROGRAM ""I want to thank all those who have come together from across the Métis Homeland to guide and assist in the development of this program. The Métis National Council is committed to keeping the memory of our WWII Métis Veterans alive and to promote arwareness of their contributions and sacrifices for generations to come."" Vice President David Chartrand, June 2020 The Métis Veterans Legacy Programrecognizes the wrongs Second World War Veterans experienced upon their return to Canada and will support Recognition Payment. If you are a Surviving Child of a W'WII Métis Veteran who died on or after January 1, 2016, you may also be eligible. For more information on bow to apply please visit: metisveterans.ca/how-to-apply/ commemorative initiatives of our WWII Heroes. Many of our Métis Veterans did not receive the same supports, resources or benefits promised to them that their non-Métis comrades enjoyed. The Métis Veterans Legacy Program provides for qualified WWII Veterans to receive compensation for their pre and post-war experiences. The permanent Commemoration Program, which supports commemorative initiatives that promote the awareness and appreciation of our WWII Métis Veterans sacrifices and contributions, will commence in August 020. For more information, please visit: metisveterans.ca/legacy-fund-and- mmemorative-pct/ If you are a WWII Métis Veteran or a Surviving Spouse or a Common-law partner, you may be eligible for the Métis Veterans Legacy Program For more information please contact: MÉTIS VETERANS LEGACY PROGRAM c/o Métis National Council #+-340 MacLaren Ave. Ottawa, ON Tel: (800) 928-6330 ext 532 Fax: (613) 232-1262 Email: veteran.info@metisnation.ca www.metisveterans.ca MÉTIS VETERANS LEGACY PROGRAM EST. 2019 Our Heroes Today, Tomorrow and Forever. MÉTIS NATION 8 ADVERTISEMENT On behalf of the Métis National Council, Minister and Vice-President David Chartrand is honoured to announce the establishment of the MÉTIS VETERANS LEGACY PROGRAM ""I want to thank all those who have come together from across the Métis Homeland to guide and assist in the development of this program. The Métis National Council is committed to keeping the memory of our WWII Métis Veterans alive and to promote arwareness of their contributions and sacrifices for generations to come."" Vice President David Chartrand, June 2020 The Métis Veterans Legacy Programrecognizes the wrongs Second World War Veterans experienced upon their return to Canada and will support Recognition Payment. If you are a Surviving Child of a W'WII Métis Veteran who died on or after January 1, 2016, you may also be eligible. For more information on bow to apply please visit: metisveterans.ca/how-to-apply/ commemorative initiatives of our WWII Heroes. Many of our Métis Veterans did not receive the same supports, resources or benefits promised to them that their non-Métis comrades enjoyed. The Métis Veterans Legacy Program provides for qualified WWII Veterans to receive compensation for their pre and post-war experiences. The permanent Commemoration Program, which supports commemorative initiatives that promote the awareness and appreciation of our WWII Métis Veterans sacrifices and contributions, will commence in August 020. For more information, please visit: metisveterans.ca/legacy-fund-and- mmemorative-pct/ If you are a WWII Métis Veteran or a Surviving Spouse or a Common-law partner, you may be eligible for the Métis Veterans Legacy Program For more information please contact: MÉTIS VETERANS LEGACY PROGRAM c/o Métis National Council #+-340 MacLaren Ave. Ottawa, ON Tel: (800) 928-6330 ext 532 Fax: (613) 232-1262 Email: veteran.info@metisnation.ca www.metisveterans.ca MÉTIS VETERANS LEGACY PROGRAM EST. 2019 Our Heroes Today, Tomorrow and Forever. MÉTIS NATION 8",[]
45,nationalpost,http://local.nationalpost.com/toronto-ca-on/forest-hill-real-estate-julie-gofman-team-416-488-2875/2020-07-11-11204923-ferest-hill-excellent-service-exceptional-results-real-estate-inc-brokerage-welcome-to-summer-2020-toronto-real-estate-market-the-best-time-to-buy-slash-sell-opportunity-is-now-just-listed-luxury-homes-new-plisting-81-dunloe-road-hgn-l-,"SATURDAY, JULY 11, 2020 Ad",[],2020-07-11,"Ferest Hill EXCELLENT SERVICE EXCEPTIONAL RESULTS! REAL ESTATE INC BROKERAGE WELCOME TO SUMMER 2020 TORONTO REAL ESTATE MARKET THE BEST TIME TO BUY/SELL! OPPORTUNITY IS NOW! JUST LISTED LUXURY HOMES NEW PLISTING 81 DUNLOE ROAD hgn l OOFA Ap 0 O n Be inghee Cf Qulty lk w om w We Caler And mriaa deped Ranpned und ge Cl $7,295,000 Mgl 72 PRUE AVENUE SOLD NÉW PLISTING Julie Gofman $3,295,000 76 SHALLMAR BOULEVARD y o ying ly O el O ha H Ad Cng o d, ing N M P y C Eite Diamond Award o Ca y Ce d w of Distinction Direct: 416.561.0340 Office: 1.800.466.2218 Se $2,995,000 51 SHALLMAR BOULEVARD ""Trusted* ""Respected *Recommended r foet bedoom p p SOLD Work With Me- IWI Bring You Results Featured in International Top Agent Magazine As k ed nd Cow piy pin ho d nd h d $3,495,000 5o8 VESTA DRIVE Ct Oding t s CANADA'S TOP AGENT tl do O A t nl C s Co SOLD Glg d Sol e e Shold Cl Meg A whte A Gane oton oO oe OA l ellaol und s oAC d ASl O ng e $3,288,000 Er julgotman@gmail.com www.juliegofman.com Salen epresentatie SOLD IN FOREST HILL FOR MANY IF YOU ARE PLANNING TO SELL EXCLUSIVE SOLD LD YOUR PROPERTY LISTINGS IT WOULD BE MY IN FOREST PLEASURE TO MEET WITH YOU HILL, PLEASE a9 FOREST HILL ROAD 22 SILVERWOOD AVENUE 1U RIDOEWOOD ROAD TO DISCUSS, PLEASE CALL ME AT CALL DIRECT S au e M 416.561.0340 416.561.0340 I APPRECIATE THE S O a OPPORTUNITY www.UUROOFMAN.COM TO EARN YOUR SO S7,0sa,000 O 5,s00,000 I ,895,000 BUSINESS JULIE GOFMAN TEAM ROMAN GOFMAN, P. ENG* DIRECT 416.561.0340 gofmanrom@gmail.com MARYAM JALILALGHADR, B. ENG* DIRECT 416.838.0420 jalilalghadr@gmail.com f in Ferest Hill EXCELLENT SERVICE EXCEPTIONAL RESULTS! REAL ESTATE INC BROKERAGE WELCOME TO SUMMER 2020 TORONTO REAL ESTATE MARKET THE BEST TIME TO BUY/SELL! OPPORTUNITY IS NOW! JUST LISTED LUXURY HOMES NEW PLISTING 81 DUNLOE ROAD hgn l OOFA Ap 0 O n Be inghee Cf Qulty lk w om w We Caler And mriaa deped Ranpned und ge Cl $7,295,000 Mgl 72 PRUE AVENUE SOLD NÉW PLISTING Julie Gofman $3,295,000 76 SHALLMAR BOULEVARD y o ying ly O el O ha H Ad Cng o d, ing N M P y C Eite Diamond Award o Ca y Ce d w of Distinction Direct: 416.561.0340 Office: 1.800.466.2218 Se $2,995,000 51 SHALLMAR BOULEVARD ""Trusted* ""Respected *Recommended r foet bedoom p p SOLD Work With Me- IWI Bring You Results Featured in International Top Agent Magazine As k ed nd Cow piy pin ho d nd h d $3,495,000 5o8 VESTA DRIVE Ct Oding t s CANADA'S TOP AGENT tl do O A t nl C s Co SOLD Glg d Sol e e Shold Cl Meg A whte A Gane oton oO oe OA l ellaol und s oAC d ASl O ng e $3,288,000 Er julgotman@gmail.com www.juliegofman.com Salen epresentatie SOLD IN FOREST HILL FOR MANY IF YOU ARE PLANNING TO SELL EXCLUSIVE SOLD LD YOUR PROPERTY LISTINGS IT WOULD BE MY IN FOREST PLEASURE TO MEET WITH YOU HILL, PLEASE a9 FOREST HILL ROAD 22 SILVERWOOD AVENUE 1U RIDOEWOOD ROAD TO DISCUSS, PLEASE CALL ME AT CALL DIRECT S au e M 416.561.0340 416.561.0340 I APPRECIATE THE S O a OPPORTUNITY www.UUROOFMAN.COM TO EARN YOUR SO S7,0sa,000 O 5,s00,000 I ,895,000 BUSINESS JULIE GOFMAN TEAM ROMAN GOFMAN, P. ENG* DIRECT 416.561.0340 gofmanrom@gmail.com MARYAM JALILALGHADR, B. ENG* DIRECT 416.838.0420 jalilalghadr@gmail.com f in",[]
46,nationalpost,http://local.nationalpost.com/burlington-ca-on/the-directors-college-855-905-4943/2020-07-09-11200575-the-directors-college-the-pace-of-change-is-accelerating-build-momentum-by-becoming-an-accredited-chartered-director-c-dot-dir-dot-board-members-are-faced-with-new-challenges-to-innovate-grow-compete-and-govern-while-operating-in-a-stat,"THURSDAY, JULY 9, 2020 Ad",[],2020-07-09,"The Directors College The Pace of Change is Accelerating Build momentum by becoming an Accredited Chartered Director (C.Dir.) Board members are faced with new challenges to innovate, grow, compete, and govern while operating in a state of unpredictable change. Leaders committed to responsible and sustainable governance must continually adapt, develop their skills, and evolve to add enhanced value and keep pace. Learn to raise the art and impact of directorship through an education program that brings strategic wisdom, diversity of thought, and innovative approaches to the board table. Register Now for Fall 2020 Modules thedirectorscollege.com DeGroote McMaster University ...... BRIGHTER WORLD The Directors College The Pace of Change is Accelerating Build momentum by becoming an Accredited Chartered Director (C.Dir.) Board members are faced with new challenges to innovate, grow, compete, and govern while operating in a state of unpredictable change. Leaders committed to responsible and sustainable governance must continually adapt, develop their skills, and evolve to add enhanced value and keep pace. Learn to raise the art and impact of directorship through an education program that brings strategic wisdom, diversity of thought, and innovative approaches to the board table. Register Now for Fall 2020 Modules thedirectorscollege.com DeGroote McMaster University ...... BRIGHTER WORLD",[]
